CSZJJ No.,CSZJJ Title,Taisho No.,File,Summary
665,內外六波羅蜜經,T 778,$nti/t0778_01.txt,"This text describes the six perfections (檀波羅蜜, 尸波羅蜜, 羼提波羅蜜, 惟逮波羅蜜, 禪波羅蜜, 般若波羅蜜) as internal practices for Bodhisattvas, focusing on controlling the senses and mind to overcome negative qualities like greed, anger, and ignorance. Each perfection corresponds to a specific sense organ, with generosity linked to the body, morality to the eye, patience to the ear, diligence to the nose, meditation to the mouth, and wisdom to the mind. Through these practices, one can purify the mind, achieve enlightenment, and ultimately reach Nirvana by understanding the emptiness and impermanence of all things."
832,大比丘威儀經,T 1470,,"This text outlines various aspects of monastic life for Buddhist monks, covering practices ranging from asceticism and proper conduct to duties and responsibilities within the sangha (monastic community). It details rules for daily activities like eating, dressing, and interacting with laypeople, as well as guidelines for senior monks (Upadhyayas/Acharyas) in guiding junior monks and managing the monastery. It emphasizes adherence to precepts, maintaining purity, and cultivating qualities like diligence, compassion, and respect within the monastic order. Additionally, the text describes proper procedures and regulations for various ceremonies, such as Uposatha, and the importance of ethical conduct."
834,觀無量壽經,T 365,,"This text, the ""Contemplation Sutra,"" tells the story of Queen Vaidehi, imprisoned by her son, and her plea to the Buddha for a place of peace. The Buddha appears and shows her various Buddha lands, leading her to choose the Pure Land of Amitabha. He then teaches her and all beings sixteen visualizations to achieve rebirth in this Pure Land, a realm of immense beauty and enlightenment, by contemplating its features and Amitabha Buddha. The text emphasizes that even those who have committed wrongdoings can be reborn in the Pure Land through repentance and devotion to Amitabha."
842,採華違王上佛授記妙華經,T 510,,"The story recounts how a group of flower gatherers, tasked with providing flowers for the king, encountered the Buddha and offered their flowers to him instead. Realizing they disobeyed the king's order and could face execution, they prepared for the worst. The king, angered by their disobedience and curious about their lack of fear, learned from the Buddha that their act of devotion led to a prediction (授決) of their future Buddhahood, named ""妙華如來"" (Wonderful Flower Tathagata), and that their baskets miraculously remained full of fragrant flowers as a result of their faith. The king, amazed and repentant, released them and sought forgiveness for his initial anger."
851,佛以三事笑經,T 152 (65),,"This text recounts a story where the Buddha laughs three times while walking through a city. The first instance is triggered by a grieving old man selling fish, lamenting the death of his son who used to do the same work, and the second by a pig bathing in urine. The Buddha explains to Ananda that the laughter arises from the old man's hypocrisy of killing living beings and blaming heaven for his misfortune, the former emperor now reduced to selling fish, and the previous emperor who used up his merit and is now suffering the consequences for not detaching from earthly attachments. Finally, the Buddha highlights his past virtuous actions of devoutly listening to the Dharma, which led him to Buddhahood, contrasting it with his neighbor's wicked ways that resulted in endless suffering."
855,作佛形像經,T 692,,"The text describes a conversation between the Buddha and King Udayana, a young ruler eager to learn about the benefits of creating Buddha images. The Buddha explains that making Buddha images leads to auspicious rebirths, characterized by physical beauty, wealth, noble status, and ultimately, the path to Nirvana. The king and his ministers, delighted by this teaching, pay homage to the Buddha and are later reborn in Amitabha's Pure Land."
859,稱揚諸佛功德經,T 434,,"This text, a sutra translated by Jikaya of the Yuan Wei dynasty, details the merits of reciting the names of various Buddhas. Shakyamuni Buddha, responding to Shariputra's inquiry, describes numerous Buddhas in different worlds of the Eastern, Southern, Northern and Upper directions, explaining the benefits of hearing, reciting, and revering their names, which include purification of sins, liberation from suffering, and attainment of enlightenment. It also warns against slandering the sutra, detailing the negative consequences of such actions, and promotes sincere faith and propagation of the Buddhas' virtues. The sutra emphasizes that hearing and reciting the names of these Buddhas is a powerful means of accumulating merit and progressing on the path to enlightenment."
863,八部佛名經,T 429,,"The Buddha, while residing in a garden with a large assembly of monks and bodhisattvas, is approached by a layman named Good Deeds who asks about Buddhas currently teaching in the world. The Buddha then describes eight Buddhas in the East, each with a unique name and residing in a distinct world, emphasizing the merit and protection gained by reciting their names. By upholding these names and teaching them to others, one can achieve increased virtue, avoid negative experiences, and even gain protection from various dangers and adversaries."
874,觀藥王藥上二菩薩經,T 1161,,"The text is a Buddhist scripture called ""The Sutra on Visualizing the Two Bodhisattvas, Medicine King and Medicine Superior,"" in which the Buddha is in a meditative state, emitting light that reveals the two Bodhisattvas. The scripture details the past lives, vows, and virtues of these Bodhisattvas, as well as mantras to recite for purification and healing. It explains how visualizing and honoring them can lead to liberation from suffering, purification of karmic debts, and future Buddhahood. The sutra emphasizes that faith and practice related to these bodhisattvas can bring immense blessings in both this life and future lives."
875,請觀世音經,T 1043,,"This sutra describes a crisis in the city of Vaisali where people are afflicted with terrible illnesses caused by malevolent spirits. The Buddha, upon request from a worried elder, instructs the people to seek refuge in Avalokitesvara (Guanyin) and Amitabha Buddha of the Western Pure Land. Guanyin appears and teaches a dharani (mantra/spell) to eliminate the poisons and harm, as well as avert future disasters. The sutra emphasizes the power of reciting Guanyin's name and the dharani to overcome suffering, dispel fear, and attain peace and enlightenment."
877,文殊師利般涅槃經,T 463,,"This text is a sutra where the Buddha is residing in Jetavana Vihara in Shravasti. He radiates golden light and reveals auspicious signs foretelling the future Nirvana of Manjushri Bodhisattva. The Buddha describes Manjushri's extraordinary birth, powers, and future activities, emphasizing his role in benefiting sentient beings and teaching the Dharma, particularly in the Himalayas where he will teach the twelve-fold scriptural division to five hundred hermits. The Buddha also elaborates on the benefits of remembering, venerating, and contemplating Manjushri, leading to the purification of karmic obstacles and eventual enlightenment."
883,無言菩薩流通法經,T 397(6),,"This text from the Mahāvaipulya Mahāsaṃghāta Sūtra tells the story of the Bodhisattva ""No Speech"" (Wu Yan), who was born mute but possessed great wisdom and the ability to manifest extraordinary phenomena. Even as a child, celestial beings instructed him to contemplate the Dharma and avoid worldly matters, leading him to a life of silent contemplation and deep understanding. No Speech's profound insights and teachings, delivered through divine manifestations and profound verses, inspire countless beings to seek enlightenment. He ultimately reveals that true understanding transcends words and that the path to enlightenment lies in the realization of emptiness and the inherent equality of all things."
893,無垢施菩薩分別應辯經,T 310 (33),,"The text narrates a gathering where Buddha is in the Jeta Grove with a large assembly of monks and bodhisattvas. They encounter an eight-year-old girl, Wu Gou Shi, who engages various arhats and bodhisattvas in profound Dharma discussions, skillfully refuting their perspectives. Impressed by her deep understanding, Buddha predicts that she will become a Buddha named Wu Gou Guang Xiang Wang in the future and also predicts that 500 Brahmanas will become Buddhas."
897,無言菩薩經,T 397(6),,"This passage from the Mahāvaipulya Mahāsaṃgraha Sūtra tells the story of the Bodhisattva ""No Speech,"" a child born mute who is praised by the Buddha. Despite his muteness, No Speech is a great Bodhisattva who demonstrates profound wisdom and understanding of the Dharma, even showing miraculous powers and delivering teachings through silent means. He emphasizes the importance of contemplating the true meaning of the Dharma beyond words and the interconnectedness of all things, inspiring many to seek enlightenment."
899,異出菩薩本起經,T 188,,"This text narrates the story of how Śākyamuni Buddha became enlightened in a previous life. As a bodhisattva named Maṇava, he purchased lotus flowers to offer to the Buddha Dīpankara, receiving a prophecy that he would become the Buddha Śākyamuni after ninety kalpas. The text describes his subsequent rebirths and eventual birth as Prince Siddhartha, detailing the events leading to his renunciation of worldly life and his eventual enlightenment under a tree after enduring hardships and meditation. Finally, it tells about the dragon king who became his first devotee and his returning to teach his 5 former companions, leading to many conversions and miracles."
903,大方廣菩薩十地經,T 308,,"This sutra, translated by Jīkajia, describes the ten stages of a Bodhisattva's path to enlightenment, as explained by the Buddha in response to questions from the Bodhisattva Endless Wisdom. It details the characteristics, virtues, and samadhis associated with each stage, including the perfection of the ten paramitas (perfections) and the preliminary signs experienced by Bodhisattvas. The sutra also emphasizes the importance of remembering and reciting this teaching, as it leads to the attainment of various dharanis and ultimately, the realization of Buddhahood. The audience, including Bodhisattvas, monks, deities, and humans, rejoices upon hearing this teaching."
908,菩薩生地經,T 533,,"The text is a sutra called the ""Sutra of the Land Where Bodhisattvas are Born,"" translated by Zhi Qian. It recounts a conversation between the Buddha and a lay disciple named Chamoja regarding the practices that allow a Bodhisattva to quickly attain enlightenment. The Buddha emphasizes the importance of patience, moral conduct, loving the Dharma, avoiding women, and practicing generosity for achieving Buddhahood, and speaks against engaging in evil deeds, anger, and disrespect. The sutra concludes with assurances of great merit for those who believe and uphold this teaching and a warning to not dismiss it."
921,優婆塞五戒經,T 1503,$nti/t1503_01.txt,"This text is a sutra about the rules and conduct for lay Buddhist practitioners (Upasakas) who have taken the five precepts, specifically concerning the Bodhisattva precepts. It outlines many actions that constitute offenses and non-offenses. In general, a practitioner should avoid arrogance, anger, greed, harming others, and neglecting the needs of others or the dharma, with considerations for the circumstances and motivations behind the actions. The text also covers practices of devotion, ethical conduct, and the benefits of upholding the precepts for spiritual progress."
923,弟子學有三輩經,T 767,$nti/t0767_01.txt,"This sutra, translated by Zhi Qian, describes the three types of lay disciples (Upasakas and Upasikas) based on their adherence to the five precepts and their practice of the Bodhisattva path. The highest level diligently upholds the precepts, actively guides others towards enlightenment with a Bodhisattva mind, and selflessly teaches the Mahayana path without seeking personal gain. The middle level also upholds the precepts but lacks deep understanding and proficient guidance, while the lowest level violates the precepts, criticizes wise teachers, and selfishly uses their position to gain offerings, leading to negative consequences. The Buddha emphasizes the importance of gathering to discuss the Dharma and avoiding association with such misguided individuals to prevent harm to the teachings."
924,弟子死復生經,T 862,$nti/t0826_01.txt,"This text, ""Sutra of the Disciple Who Died and Was Reborn,"" tells the story of a devout follower of Buddhism who dies and is taken to the underworld. There, the king of the underworld interrogates him about his life and the practices of Buddhist monks, before learning that he was not meant to die yet due to his remaining years and eventual return to the Buddhist teachings. The disciple is then returned to life and shares his experience with the Buddha, who elaborates on the importance of upholding the Buddhist precepts and the consequences of both good and evil actions in the cycle of rebirth. The sutra emphasizes the power of the Buddha's teachings to protect and guide followers away from suffering."
967,頂生王故事經,T 39,$nti/t0039_01.txt,"The text tells the story of King Top-Born (頂生王), a powerful ruler who conquered the four corners of the world and eventually ascended to the heavens to rule alongside Indra. Driven by insatiable desire, he plotted to usurp Indra's throne, but his ambition led to his downfall and a painful return to the human realm. The Buddha uses this story to illustrate that worldly desires are never truly fulfilling and only lead to suffering. True satisfaction comes from attaining enlightenment and transcending these desires."
968,頻毘婆王詣佛供養經,T 133,$nti/t0133_01.txt,"This text recounts the story of King Bimbisara of Magadha visiting and making offerings to the Buddha. Initially, the Buddha was residing in Sravasti, where he was revered and provided for by many. King Bimbisara, after hearing of the Buddha's virtues, traveled to meet him, and after listening to the Buddha's teachings, the king became a devoted follower. He invited the Buddha and his monastic community to his kingdom for three months, where he provided them with all their needs, leading to the conversion of many and further spreading the Buddha's teachings."
969,阿闍世王問五逆經,T 508,$nti/t0508_01.txt,"This text, translated by Dharma Master Fa Ju of the Western Jin Dynasty, recounts a conversation between King Ajatasattu and the Buddha regarding the consequences of the five rebellious acts, particularly the king's own patricide. Devadatta attempts to reassure the king that he won't suffer for his actions, but the Buddha clarifies that Ajatasattu will initially fall into hell but will eventually progress through realms and ultimately become a Pratyekabuddha. The Buddha emphasizes the importance of intent and its impact on one's karmic journey. Finally, Jivaka, a prince, confirms the Buddha's words, but the king remains skeptical about visiting the Buddha until he is sure that the Buddha is truly all-knowing."
971,阿闍世王受決經,T 509,$nti/t0509_01.txt,"This text tells the story of King Ajatasatru seeking a prophecy from the Buddha. Initially, his grand offerings didn't earn him one, but a poor woman's sincere offering of a single lamp and a humble gardener's scattering of flowers did. The King, learning the importance of sincere intention, prepared a jeweled offering with his family, only to learn the Buddha had passed. Despite this, he offered it where Buddha had sat, and due to his sincerity, finally received a prophecy of becoming a Buddha in a future eon."
981,優填王經,T 332,$nti/t0332_01.txt,"This text tells the story of King Udyana (優填王) who, after being offered a beautiful woman by her father, is taught by the Buddha about the impure and undesirable nature of the body, particularly that of women. The king then takes the woman as his queen, but is misled by her to persecute his virtuous first queen, who is a follower of the Buddha. Eventually, the king realizes his error after witnessing her"
988,鏡面王經,T 152 (89),taisho/t0152_n89.txt,"The Buddha recounts a story of King Mirror-Face who, witnessing blind men arguing over their understanding of an elephant based on touch, realized they were like those who ignore the breadth of Buddhist scripture and cling to narrow views. He then taught his kingdom the importance of the full Buddhist teachings. The Buddha explains that the king was himself in a past life, and the arguing scholars are like the blind men, foolishly arguing from limited perspectives. He urges his disciples to understand and spread his teachings for future enlightenment and lasting Dharma."
989,察微王經,T 152 (90),taisho/t0152_n90.txt,"King Chawi, a former king who deeply studied Buddhist scriptures, believed that the elements of earth, water, fire, and wind combine to create life and that beings are reborn according to their actions. To illustrate the difficulty of understanding past lives, he staged an elaborate prank, placing a cobbler in his royal robes and then returning him to his former state after getting him drunk. The cobbler, having experienced both royal life and its subsequent ""punishment,"" realized that even a brief dream of kingship was difficult, let alone understanding the complexities of reincarnation. The Buddha reveals that King Chawi was actually himself in a past life, demonstrating the bodhisattva's wisdom and generosity."
991,桀貪王經,T 198 (1),taisho/t0198_n01.txt,"The Buddha recounts two stories to illustrate the nature of suffering and the insatiability of desire. First, he comforts a grieving Brahmin who lost his crops and daughter by explaining that loss, sickness, old age, and death are unavoidable for all beings. Then, the Buddha tells the story of King Jetta who, driven by insatiable greed, conquered several kingdoms, yet remained unhappy and sought to conquer another country until a young boy reminded him of the endless nature of desire. Ultimately, the Buddha teaches that true freedom comes from understanding and relinquishing attachment to worldly desires."
993,薩羅王經,T 520,$nti/t0520_01.txt,"The Sutra of the Sāro Kingdom describes a prosperous and pleasure-seeking kingdom called Sāro. Buddha, seeing their attachment to worldly desires, uses his divine powers and radiant light to visit the kingdom, causing miraculous events and drawing the attention of the king and his people. The king, confronted by the Buddha's wisdom, seeks a way to escape suffering, and the Buddha teaches him the importance of giving, controlling desires, following the Buddha's teachings, and respecting teachers of the Dharma. The King and his people are converted, embrace the Buddha's teachings, and the Buddha prophesizes the King's future enlightenment as the ""Light of Wisdom"" Buddha, leading the people of Sāro to future Buddhahood as well."
998,國王五人經,T 152 (24),taisho/t0154_n24.txt,"The Buddha tells a story about five brothers, each excelling in wisdom, craftsmanship, beauty, diligence, and fortune respectively, who each claimed to be the best. They travel to other countries to prove their worth, each demonstrating their unique abilities and acquiring great rewards. The brother with fortune eventually becomes king, and the others serve him, demonstrating that fortune surpasses the other qualities. The Buddha reveals that in this past life, the brothers were the present-day disciples Shariputra, Aniruddha, Ananda, Suna, and the Buddha himself, emphasizing that even then, he was superior and they are now his followers."
999,太子刷護經,T 343,$nti/t0343_01.txt,"The Sutra tells of Prince Suhu, son of King Ajatasatru, who, with 500 others, visits the Buddha to ask about the causes of various attainments for Bodhisattvas, such as physical beauty, wisdom, and rebirth in pure lands. The Buddha explains these qualities arise from cultivating virtues like patience, non-attachment, generosity, and respect for the Dharma. The Buddha then reveals that Prince Suhu and his companions are past disciples who will become Buddhas in the future in a land similar to Amitabha's, and those who believe in this sutra will also be reborn there."
1001,舍頭諫太子二十八宿經,T 1301,$nti/t1301_01.txt,"This text recounts a story where the Buddha helps his disciple Ananda overcome a spell cast by a woman named 波機提 who desires him. She enlists her mother's help in using a powerful spell to enchant Ananda, leading him to leave the monastery and go to her home. The Buddha, aware of Ananda's plight, intervenes with his own incantation to break the spell and lead Ananda back to the monastery. Ultimately, the woman is converted, becoming a Buddhist nun and achieving enlightenment."
1006,誨子經,T 154 (38),taisho/t0154_n38.txt,"This passage tells the story of a son who, after his father's death, became wayward and indulged in vices, causing his mother great concern. His mother then wisely taught him the virtues of gentleness, good companionship, encouragement, and righteousness, explaining the benefits of each. The son, realizing his past mistakes, embraced her teachings, becoming a virtuous man who eventually served as a respected minister and successfully reconciled two warring kingdoms, demonstrating the transformative power of his mother's guidance. Finally, the Buddha warns of a future where such teachings may be disregarded by a depraved generation."
1012,五百幼童經,T 154 (33),taisho/t0154_n33.txt,"The Buddha, while in the country of Bārāṇasī, learns of 500 children who drowned in a flood while playing together building sand pagodas. The Buddha reveals that this was their karma from 500 previous lives, and that they have been reborn in the Tuṣita Heaven. He then calls the children down, who pay homage to the Buddha and ask their parents not to grieve, but to practice the Dharma. The children then return to Tuṣita Heaven, and the parents, comforted, take refuge in the Buddha's teachings."
1015,逝童子經,T 527,$nti/t0527_01.txt,"The text describes how the Buddha, while begging for alms, was seen by a sixteen-year-old boy named Shi (逝) who was immediately filled with reverence. Shi offered his food and clothing to the Buddha, expressing his desire to attain the same wisdom as the Buddha, rather than worldly riches. The god Indra initially tried to dissuade him, but Shi remained steadfast, impressing even Indra with his resolve. The Buddha then prophesied that after countless lifetimes of virtuous deeds, Shi would ultimately become a Buddha named Sumi Jie (須彌劫)."
1024,長者詣佛說子婦不恭經,T 143,$nti/t0143_01.txt,"The Jade Maiden Sutra tells the story of a woman named Jade Maiden, wife of the son of Anāthapiṇḍika, who was arrogant and disrespectful towards her elders. Buddha uses his powers and teachings to humble Jade Maiden, revealing the ten evils of women and describing the duties and virtues of a good wife, as well as the different types of wives that exist. Jade Maiden is repentant and vows to become a virtuous wife, following the Buddha's teachings and taking vows as a lay follower (Upasika). The Buddha then blesses her and instructs her to follow the precepts, ensuring her a better future life."
1025,長者子制經,T 526,$nti/t0526_01.txt,"This text tells the story of a wealthy young man named Zhi (制), who encounters the Buddha while he is begging for food. Impressed by the Buddha's appearance, Zhi offers his own meal and clothes, expressing his desire to become a Buddha himself. Despite the doubts voiced by the god Śakra, Zhi insists on his aspiration with unwavering determination, vowing to endure any hardship to achieve enlightenment. Buddha then prophesizes that after countless eons, Zhi will become a Buddha named Sumerukara and will save countless beings."
1026,長者子懊惱三處經,T 525,$nti/t0525_01.txt,"A wealthy, childless couple prays for a son who is eventually born, but tragically dies after falling from a tree. Overcome with grief, they are visited by the Buddha who explains that their son's soul had previously resided in the Heaven of the Thirty-three and will be reborn as a dragon, only to be devoured by a golden-winged bird, thus experiencing sorrow in three places. The Buddha consoles the parents, explaining that their son's early death was the result of past actions of hunting and harming other living beings, while his wealth was a result of generosity in a past life, emphasizing the concept of karma."
1039,十支居士八城人經,T 92,$nti/t0092_01.txt,"This text describes a meeting between the Venerable Ananda and a group of lay Buddhists from eight cities. The laymen, pleased with their successful business in the city, seek out Ananda to ask about how to achieve liberation. Ananda explains that through various practices like detachment, cultivating loving-kindness, and meditation, one can attain freedom from suffering and reach enlightenment. The laymen are deeply impressed and offer a generous donation to Ananda, who then shares it with the monastic community."
