CSZJJ No.,CSZJJ Title,Taisho No.,File,Summary
81,四願經,T 735,$nti/t0735_01.txt,"This text recounts a story where the Buddha teaches a grieving father about the impermanence of life and the futility of earthly attachments. The Buddha explains that four things humans desire—a healthy body, wealth, loved ones, and control over their mind—cannot be guaranteed or taken with them after death. He emphasizes the importance of guarding one's mind, understanding the impermanence of all things, and abandoning earthly desires to escape suffering and achieve liberation. By doing so, one can break free from the cycle of death and rebirth and attain enlightenment."
82,悔過經,T 1492,$nti/t1492_01.txt,"The Buddha, residing at Vulture Peak Mountain, addresses Sariputra's inquiry about how to repent for past evil deeds to attain Buddhahood. The Buddha advises individuals to confess their past transgressions, including harming others, disbelief, and stealing from the temple, at specific times of the day, vowing to refrain from repeating them.  He emphasizes that sincere repentance is essential for avoiding negative rebirths and achieving enlightenment, and encourages rejoicing in the merit of all beings. He concludes that reciting this repentance sutra with devotion surpasses even the merit of offering to countless Arhats."
85,了本生死經,T 708,$nti/t0708_01.txt,"This text, presented as a discourse by the Buddha and elaborated upon by a wise disciple, explains the principle of dependent origination (""緣起""), which is the foundation of understanding the Dharma (law) and oneself. It describes how external and internal phenomena arise through interconnected causes and conditions, highlighting the impermanent and non-self nature of existence.  The text also contrasts dependent origination with the cessation of suffering achieved by those who attain enlightenment, escaping this cycle of interdependent arising. By understanding dependent origination, one can understand the Four Noble Truths and break free from the cycle of suffering."
88,龍施女經,T 557,$nti/t0557_01.txt,"The Buddha, while in a city, was seen by a fourteen-year-old girl named Dragon Offering, who was so inspired that she vowed to seek enlightenment. A demon, fearing her potential, tried to dissuade her, suggesting she seek to be an Arhat instead of a Buddha. Undeterred, Dragon Offering demonstrated her commitment by leaping from a high building, and miraculously transformed into a man mid-air. Inspired, many others also vowed to seek enlightenment, causing the demon to depart in shame."
92,賴吒和羅經,T 68,$nti/t0068_01.txt,"The text recounts the story of Raṭṭhapāla, a wealthy man's son, who renounces his worldly life after hearing the Buddha's teachings and becomes a monk. Despite his parents' initial opposition and attempts to dissuade him with wealth and women, Raṭṭhapāla remains steadfast in his commitment. After becoming a monk and mastering the teachings, he returns to his homeland and convinces the king of the importance of spiritual practice over worldly possessions, leading the king to embrace the Buddha's path. The story highlights themes of impermanence, detachment, and the pursuit of enlightenment over material wealth."
488,道地經中要語章,T 608,$nti/t0608_01.txt,"This text discusses the path to enlightenment, focusing on the causes that hinder and help a practitioner achieve inner peace and wisdom. It emphasizes the importance of mindfulness, self-control over desires and senses, and understanding the cycle of karma. The text also outlines specific illnesses of the body, mind, and breath, along with methods to counteract them, stressing the need for virtuous actions and guarding against negative thoughts and behaviors to progress on the path. Finally, it outlines three aspects of precepts and how one must understand them to follow the path of a Bodhisattva."
490,梵志頗波羅延問尊種經,T 71,$nti/t0071_01.txt,"A group of Brahmins believed their caste was superior and directly descended from the god Brahma, born from his mouth. They challenged the Buddha's teaching that all castes are equal and that actions, not birth, determine one's worth. The Buddha refuted their claims by highlighting examples of inter-caste marriage, the ability of individuals to change social status through actions, and the irrelevance of caste in matters like physical needs or salvation. He emphasized that moral conduct and intention are what truly differentiate people, not lineage, ultimately leading the Brahmin representative to acknowledge the validity of the Buddha's teachings."
492,颰披陀菩薩經,T 419,$nti/t0419_01.txt,"The text describes a gathering at the Bamboo Garden where Buddha is present with numerous disciples, bodhisattvas, kings, and celestial beings. The Bodhisattva Bapo asks Buddha how to attain a certain Samadhi (state of meditative consciousness) characterized by immense wisdom, unwavering resolve, and constant connection to enlightened principles. Buddha explains the qualities, practices, and visualizations needed to achieve this state and directly perceive the Buddha Amitabha in his Pure Land, as well as emphasizing the importance of respecting the Dharma and those who preach it. The Buddha further emphasizes the vast merit gained from simply hearing and accepting this teaching, even more so than giving the world's riches to the Buddhas."
499,魔王入目犍蘭腹經,T 66,$nti/t0066_01.txt,"The story begins with the Venerable Maha Maudgalyayana meditating when Mara, the evil one, enters his stomach. Maha Maudgalyayana, aware of Mara's presence, confronts him and orders him to leave. Mara initially doubts the monk's abilities, but eventually complies, appearing before Maha Maudgalyayana. The story then recounts an incident from a past life of the Buddha when Mara harassed his disciples, leading to the Buddha's teachings on compassion and impermanence as ways to overcome Mara's influence."
522,佛本行經,T 193,taisho/t0193.txt,"This text is a Buddhist scripture that begins with praises of the Buddha and his teachings, urging listeners to attentively receive the Dharma. It emphasizes the importance of controlling desires and cultivating wisdom to escape suffering and attain enlightenment. The text narrates the Buddha's journey from his birth and renunciation to his enlightenment, his triumph over temptation, and the establishment of his teachings, including encounters with various figures and the conversion of followers. The text describes events surrounding the Buddha’s death, including the division of the relics and the deep mourning of both humans and deities, stressing the impermanence of life and the importance of following the path to liberation."
523,河中大聚沫經,T 106,$nti/t0106_01.txt,"The Buddha, while by a river, points out a mass of foam floating on the water and uses it as an analogy to illustrate the impermanent and insubstantial nature of the five aggregates of existence: form, feeling, perception, mental formations, and consciousness. Each aggregate is compared to something fleeting or illusory, like bubbles, mirages, banana trees or illusions, emphasizing that they are empty and unreliable. He urges the monks to observe and contemplate these aggregates to realize their true nature and ultimately transcend suffering."
524,聞城譬經,T 713,$nti/t0713_01.txt,"The Buddha, while residing in Jetavana, teaches the bhikkhus about the chain of dependent origination, explaining how ignorance leads to suffering, old age and death. Through contemplation, the Buddha realized that each element in the chain, from ignorance to old age and death, arises due to a preceding condition and ceases when that condition is removed. He encourages the bhikkhus, bhikkhunis, upasakas and upasikas to follow this path of understanding to attain liberation from suffering, emphasizing the importance of proper practice and adherence to the Dharma."
526,自守亦不自守經,T 107,$nti/t0107_01.txt,"The Buddha teaches monks about the concept of self-control and the lack thereof, explaining that failing to guard the six senses (eyes, ears, nose, mouth, body, and mind) leads to suffering, lack of concentration, and ultimately, ignorance and bondage. Conversely, the practice of diligently guarding the senses brings joy, concentration, wisdom, and liberation from doubt and attachments. By mastering the senses, one attains peace and true understanding."
529,聽施比丘經,T 504,$nti/t0504_01.txt,"A monk named Listening-Giving expresses his struggles with staying awake during teachings, lacking interest in practice, and doubting the scriptures. The Buddha advises that neglecting self-discipline and failing to contemplate wholesome principles hinders understanding and practice. The Buddha then uses an analogy of a person who doesn't know the road, and a fork in the road that one must choose between evil and good paths to illustrate the path to enlightenment, emphasizing the importance of avoiding negative thoughts and desires while cultivating virtues. Finally, the Buddha encourages Listening-Giving to practice diligently in solitude, free from worldly attachments, to achieve liberation, and Listening-Giving rejoices at the Buddha's teachings."
530,善馬有三相經,T 114,$nti/t0114_01.txt,"The Buddha explains that a good horse possesses three qualities: the ability to run well, strength, and good appearance, which makes it suitable for royal service. Similarly, a good person also has three qualities: understanding suffering and its causes, having the strength to eliminate bad habits and cultivate good ones, and avoiding worldly pleasures to achieve enlightenment. By possessing these qualities, a virtuous person can gain respect and benefit all beings."
531,馬有八弊惡態經,T 115,$nti/t0115_01.txt,"The Buddha describes eight undesirable behaviors of horses, such as resisting commands, biting, and refusing food. He then draws a parallel, outlining eight similar negative behaviors found in people. These human failings include avoiding listening to teachings, becoming angry when teachings are unclear, rejecting guidance, being argumentative, being disrespectful, being distracted, being unable to answer questions, and procrastinating on learning and practicing the dharma until it is too late. The Buddha concludes by stating that these eight negative traits in people are analogous to the undesirable behaviors seen in horses."
570,彌連經,T 152(39),taisho/t0152_n39.txt,"The Buddha recounts the story of a merchant named Milan who, after surviving a shipwreck, stumbles upon a series of increasingly opulent cities populated by beautiful women. Unsatisfied, Milan continues his journey until he reaches an iron city where he is punished for his insatiable desires with a fiery wheel upon his head for eons. The Buddha reveals that Milan was his past self, and this suffering was a consequence of his past actions, while the joy he experienced was because of keeping the eight precepts one day. The Buddha concludes that true contentment is only found through the path of enlightenment and virtuous living, not through worldly pleasures."
571,阿鳩留經,T 529,$nti/t0529_01.txt,"The Buddha recounts the story of a wealthy merchant, Ajuku, who initially disbelieved in karmic consequences and the afterlife. During a journey, Ajuku and his companions face starvation until they encounter a benevolent being who provides them with food, water, and treasure and advises Ajuku to use his wealth for charitable deeds and to support religious mendicants. Inspired by this encounter, Ajuku returns home and practices generosity extensively, which leads to his rebirth in a heavenly realm, although his merits are surpassed by a poor woman's simple offering to a monk."
576,栴檀樹經,T 805,$nti/t0805_01.txt,"The Buddha tells a story of a man who was saved by a sandalwood tree spirit in the mountains and promised to spread the tree's fame. When the king fell ill and needed sandalwood, the man revealed the tree's location, leading to its felling and his own death, as the tree fell on him. The story illustrates the consequences of past actions, emphasizing that good and bad deeds have corresponding repercussions. Ultimately, the listener understands the importance of virtuous conduct in thought, word, and deed."
580,修行本起經,T 184,taisho/t0184.txt,"This text describes the events leading up to Siddhartha Gautama's enlightenment and becoming the Buddha. Dissatisfied by the inevitability of aging, sickness, and death that he witnessed, Siddhartha abandons his royal life and family, renouncing worldly pleasures to seek a path to liberation. Through encounters with hermits and rigorous ascetic practices, including meditation and fasting, he develops profound insights and ultimately overcomes the temptations and attacks of Mara, the demon king, reaching enlightenment under the Bodhi tree, attaining the highest state of awakening and understanding the nature of reality."
581,菩薩道樹經,T 532,$nti/t0532_01.txt,"While at a bamboo grove in India, the Buddha is approached by a youth named Private Me with 500 disciples, who is curious about the cause of the Buddha's extraordinary appearance and wisdom. The Buddha then details the qualities, practices, and attainments of a Bodhisattva, including the six perfections (generosity, ethics, patience, effort, concentration, and wisdom) and the resulting powers and virtues. After hearing this, Private Me and his disciples are overjoyed and vow to follow the Bodhisattva path, leading the Buddha to predict their future Buddhahood and the spread of these teachings."
582,八念經,T 46,$nti/t0046_01.txt,"The text recounts the Buddha's teachings to Anaruddha, emphasizing the importance of eight great thoughts for spiritual progress. These thoughts include desiring little, knowing contentment, seeking solitude, practicing diligence, controlling the mind, fixing the mind, cultivating wisdom, and renouncing worldly life. The Buddha elaborates on these principles and the practice of the four meditations (dhyanas) as essential for achieving liberation from suffering, detailing the path to enlightenment through mindful living and detachment from desires. Anaruddha, upon understanding and practicing these teachings, attains enlightenment and expresses his liberation in a verse."
583,禪行三十七品經,T 604,$nti/t0604_01.txt,"This Buddhist scripture emphasizes the importance of mindful practice and meditation, highlighting that even a moment of focused effort can be profoundly beneficial. It outlines key practices, including the Four Foundations of Mindfulness, the Four Right Exertions, the Four Bases of Spiritual Power, the Five Roots, the Five Powers, the Seven Factors of Enlightenment, and the Eightfold Path. The scripture suggests that diligently pursuing these practices leads to liberation from suffering, regardless of how briefly they are engaged. It encourages practitioners to diligently apply themselves to these disciplines."
584,諸法本經,T 59,$nti/t0059_01.txt,"The Buddha, residing in Jeta Grove, instructed the monks on the fundamental principles of all things. He explained that desire is the root, repeated engagement the habit, sensation the convergence, mindfulness the cause, contemplation the path, samadhi the best, wisdom the highest, liberation the firmest, and Nirvana the ultimate. The monks should cultivate detachment from worldly pleasures, contemplate impermanence, suffering, and impurity, and understand the impermanence of enjoyment. By properly understanding these principles, one can abandon desire, eliminate suffering, and attain enlightenment."
585,申日經,T 535,$nti/t0535_01.txt,"The Buddha, while in Rajagriha, encounters a wealthy man named Chandraditya, devoted to Buddhism, and his envious brother Shinri, who practices unorthodox beliefs. Shinri, influenced by his teachers, plots against the Buddha, first by attempting to humiliate Chandraditya and then by inviting Buddha to a poisoned meal in a pit of fire. However, the Buddha uses his divine power to transform the trap into a lotus pond, converting Shinri and his followers to the Buddhist path and foretelling the future role of Shinri's son in spreading Buddhism in China."
586,月光童子經,T 534,$nti/t0534_01.txt,"The Buddha is visiting a city and teaching the dharma, attracting followers and angering local heretics. These heretics conspire with a wealthy man, who plans to invite the Buddha to a poisoned meal trap. The man's son, however, warns him against harming the Buddha. Eventually, the Buddha, knowing the plan all along, uses his divine power to transform the trap into a beautiful lotus pond, converting the wealthy man and many others to Buddhism."
587,梵志孫陀耶致經,T 582,$nti/t0582_01.txt,"The text describes a Brahmin named Sundarika Bharadvaja who believed his ascetic practices were superior to those of the Buddha's monks. The Buddha then explains that true purity comes not from rituals like bathing, but from abandoning twenty-one evil thoughts and cultivating inner peace. Hearing this, the Brahmin realizes his error, becomes a monk, and quickly attains enlightenment by meditating on the Buddha's teachings."
588,枯樹經,T 806,$nti/t0806_01.txt,"The text describes an event where the Buddha, returning from teaching his mother, reveals a stupa of a past Buddha (Kasyapa Buddha) located beneath the earth. This stupa, made of colorful jade and precious materials, was originally located at the city gate, but miraculously moved to a forest location after a king attempted to destroy it. The location of the stupa was chosen for the gathering of scriptures because the location prevented emotional distress for the audience. A monastery was built near the stupa, later renovated by a different king, and it still exists today."
591,法律三昧經,T 631,$nti/t0631_01.txt,"The Buddha discusses the ""Law Samadhi,"" cautioning against pitfalls in learning and practicing the Dharma, especially concerning pride, misunderstanding, and disrespect towards teachers and the teachings. He outlines twelve ways practitioners can ""burn themselves"" through improper conduct and emphasizes the importance of diligent study, proper guidance, and avoiding ego-driven pursuits. Ultimately, the text differentiates the practices and attainments of disciples, self-enlightened individuals, Buddhas, and those following external paths, while underscoring the vastness of the Buddha's wisdom and the importance of compassion and skillful means."
594,三十二相經,T 26 (59),taisho/t0026_n059.txt,"While the Buddha was residing in the Jeta Grove, monks were discussing the significance of the 32 marks of a great man, suggesting that such a man would either become a universal monarch or an enlightened Buddha. Overhearing this, the Buddha approached the monks and confirmed their interest in learning more about these marks. He then proceeds to describe each of the 32 characteristics in detail, reiterating that someone with these marks would inevitably become one of the two."
596,演道俗經,T 820,$nti/t0820_01.txt,"The Buddha, in response to a question from a householder, explains the differences between lay and monastic life, focusing on how each can achieve enlightenment. He categorizes wealth into three types—lower, middle, and upper—based on how it's used, and elucidates three paths of monastic practice: Śrāvaka, Pratyekabuddha, and Mahayana. He further elaborates on the practices associated with each path and emphasizes the importance of compassion and wisdom for achieving ultimate enlightenment and benefiting all beings, concluding with advice on how to start on the path and clarifying that each practitioner progresses according to their own motivations."
597,黑氏梵志經,T 583,$nti/t0583_01.txt,"The story recounts how a skilled Brahman named Kala, learned that he only had seven days to live and would be reborn in hell due to a moment of anger at the end of his life. Upon hearing this news, Kala sought the Buddha's help. The Buddha instructed him to ""let go"" of his attachments, not just physical possessions, but also his past, future, and present, to transcend suffering. Following this advice, Kala became a monk, attained enlightenment, and avoided his predicted fate, thus illustrating the power of the Buddha's teachings and the ability to change one's destiny through spiritual practice."
598,大愛道般泥洹經,T 144,$nti/t0144_01.txt,"The Buddha explains that just as a good horse possesses three qualities (good pace, strength, and beauty) that make it suitable for service, so too does a good person. These qualities in a person are understanding suffering, having the strength to abandon evil and cultivate good, and avoiding worldly pleasures to attain higher spiritual states. Possessing these three qualities makes a person worthy of respect and capable of benefiting the world."
599,頗多和多耆經,T 740,$nti/t0740_01.txt,"While the Buddha was residing in a place with many trees in the kingdom of Wei-ye, a celestial being named sandalwood Tiaofu came to him seeking to understand a specific scripture on giving.  The Buddha then proceeded to explain to the assembled monks the principles of giving, contrasting the actions and motivations of foolish individuals with the true merits of charitable acts. He detailed how ignorance, selfishness, and a lack of faith diminish the benefits of giving. Finally, the celestial being and the monks rejoiced and expressed gratitude to the Buddha for his teachings."
601,五母子經,T 555,$nti/t0555a_01.txt,"A young boy becomes a monk and develops extraordinary abilities, including remembering his past lives. He recalls being reborn as the son of five different mothers, each of whom suffered greatly from his death, absence, or fate.  He laughs at the irony of one being causing so much grief across multiple lives and families.  He expresses compassion for those trapped in the cycle of suffering and praises the path of enlightenment that leads to liberation from rebirth."
602,無垢賢經,T 562,$nti/t0562_01.txt,"The Buddha is teaching a vast assembly when a woman, pregnant with a daughter, is also listening. The unborn daughter is noted by a disciple, who observes her listening in the womb, which prompts the Buddha to reveal that all beings, even in utero, can listen to the Dharma. The daughter is born enlightened, transforming the assembly and inspiring others to seek enlightenment. The Buddha commends her for her compassion and states that he, too, guides all beings."
603,八關齋經,T 89,$nti/t0089_01.txt,"The Buddha, residing in the Jeta Grove, teaches monks about the Holy Eight Precepts. These precepts guide lay followers to emulate Arhats by abstaining from killing, stealing, unchastity, lying, intoxicants, eating untimely meals, luxurious seating, and entertainment or adornments for a day and night. The Buddha emphasizes the immeasurable merit and blessings derived from practicing these precepts, comparing it to the vastness of five great rivers flowing into one."
604,逝經,T 528,$nti/t0528_01.txt,"The Buddha visits a wealthy man's house for alms, where the man's son, named Shi, is immediately captivated by the Buddha's radiant appearance and wishes to offer him food and clothing. Shi's mother initially refuses due to her greed, but Shi persists and eventually offers his own share. Inspired by Shi's devotion and desire to become a Buddha, the Buddha predicts that after countless eons, Shi will indeed achieve enlightenment and become a Buddha named Sumijialuo."
605,生死變化經,T 796,$nti/t0796_01.txt,"The Buddha, while residing at a monastery, addresses a questioning monk named Jian Zheng about the cycle of life, death, and rebirth.  Using various analogies like seeds growing into trees and clay becoming pottery, Buddha explains how consciousness transforms and moves on after death, taking on new forms based on past actions and experiences, making it impossible to return and recognize former existences.  He emphasizes the importance of practicing the Buddhist path to gain insight into this process and break free from the cycle of suffering, as without this path, one remains in ignorance, unable to see the connections between past and future lives.  After hearing the Buddha's teachings, Jian Zheng and many others attain enlightenment and become followers."
607,文陀竭王經,T 40,$nti/t0040_01.txt,"The Buddha recounts the story of King Muntajat, who, despite possessing immense wealth and power over the four corners of the world, remained insatiable. His greed led him to desire even the throne of Indra, the king of the gods, but his desire was immediately punished and he was cast back to earth, sick and dying. The Buddha uses this tale to illustrate that humans rarely find contentment and are prone to endless desire. Only the path to enlightenment and achieving Buddhahood can truly satisfy."
608,耶祇經,T 542,$nti/t0542_01.txt,"A wealthy Brahman, initially seeking blessings from various non-Buddhist paths, decides to follow the Buddha's teachings after hearing of its benefits. He takes the five precepts but struggles to restrain his desires, contemplating abandoning his vows.  However, supernatural consequences befall him when he seeks to renounce his commitment, leading him to reaffirm his faith and vow to uphold the precepts. Ultimately, he finds enlightenment and encourages his household to follow the Buddha's path, eventually becoming an Arhat."
