CSZJJ No.,CSZJJ Title,Taisho No.,File,Summary
1192,泥犁經,T 86,$nti/t0086_01.txt,"According to the Buddha, foolish individuals suffer in life due to their evil thoughts, words, and deeds, which lead to immediate consequences in the present life through physical, mental, and emotional suffering. These individuals, who indulge in harmful actions and lack faith in Buddha, Dharma, and karma, are destined to be reborn in ""Niraya"" (hell), a realm of unimaginable torment. In Niraya, beings endure horrific punishments such as being impaled, burned, dismembered, and devoured by creatures, experiencing agony beyond comprehension. The sutra emphasizes that only by abandoning evil and embracing virtuous conduct can one avoid such a dreadful fate."
1194,十八泥犁經,T 731,$nti/t0731_01.txt,"This text describes eighteen hells (泥犁) and the varying degrees of suffering experienced within them based on one's actions in life. The first eight hells are fiery, while the latter ten are cold, with punishments including being burned, crushed, and frozen for unimaginable lengths of time. The length of stay and severity of suffering in each hell depends on the severity of one's evil deeds, but knowing and practicing the Buddha's teachings can lessen the suffering or even lead to rebirth in a higher realm. Ultimately, the text emphasizes the importance of virtuous behavior and understanding the Buddha's path to avoid these hellish realms and attain a better existence."
1195,四泥犁經,T 139,$nti/t0139_01.txt,"The Buddha described four great hells to the monks, each named after an individual: Tishya, Gopaali, Devadatta, and Maskarin. Each of these figures, due to their negative actions such as causing discord, slandering the virtuous, attempting to harm the Buddha, and leading others astray, experiences immense suffering with flames engulfing them, unable to be extinguished even by vast amounts of water. The severity of their suffering is directly proportional to the gravity of their misdeeds, serving as a cautionary tale for the monks. Hearing this, the monks were delighted and committed to practicing diligently."
1200,罪業報應教化地獄經,T 724,$nti/t0724_01.txt,"The Buddha, residing in Vulture Peak Mountain, was asked by the Bodhisattva Sinxiang about the diverse conditions of beings in hell, as hungry ghosts, as animals, and as humans in various states. The Buddha responded by describing specific karmic causes for suffering in these realms, attributing them to actions such as disbelief in the Triple Gem, lack of filial piety, harming living beings, theft, and other unethical behaviors. He then taught that escaping these sufferings requires practicing filial piety, respect for teachers, taking refuge in the Triple Gem, diligently practicing generosity, upholding the precepts, patience, diligence, meditation, wisdom, compassion, and equanimity towards all beings. The teaching of the Buddha led to enlightenment and liberation for many present."
1208,鹽王五天使者經,T 43,$nti/t0043_01.txt,"The Buddha recounts observing beings' karmic destinies with divine vision, noting how good deeds lead to favorable rebirths, while evil actions result in suffering in hell. The Buddha describes how those who lacked filial piety, respect for teachers, and moral conduct during their lives are judged by King Yama, the ruler of the underworld. Yama presents five ""angel messengers""—infancy, old age, sickness, death, and punishments—as reminders of life's realities that the deceased ignored while alive, emphasizing that their suffering is a consequence of their own actions and choices. The deceased are then punished accordingly for the bad deeds they had committed in life."
1210,數經,T 70,$nti/t0070_01.txt,"The Buddha is approached by a Brahmin named Accountant who asks about the sequential nature of learning within the Buddha's teachings. The Buddha explains the progressive path of practice in his law, starting with purifying conduct and guarding the senses. He illustrates this with the analogy of someone who knows the way to a city but not everyone follows it correctly, showing that even with clear instructions, individual effort and adherence are crucial for reaching the desired goal. The Brahmin is impressed and takes refuge in the Buddha, the Dharma, and the Sangha, becoming a lay follower."
1211,時經,T 794a,$nti/t0794a_01.txt,"The Buddha, while in the Jetavana Grove in Rajagriha, instructed the monks on the proper times and improper times for certain activities, dividing the year into months and specifying auspicious and inauspicious periods within each month based on numerical calculations of ""feet"" and ""fingers"". He emphasized the importance of understanding these times for the benefit and liberation of all beings, encouraging the monks to practice diligently and avoid negligence. The monks rejoiced in this teaching, recognizing that good deeds lead to positive outcomes, while neglecting the proper conditions leads to suffering."
1213,意經,T 827,$nti/t0082_01.txt,"The Buddha is residing in Jeta Grove in Sravasti when a monk, contemplating the causes of worldly attachment and suffering, seeks guidance. The Buddha explains that the mind is the cause of attachment, suffering, and subsequent cycles of existence, and that a liberated disciple (Arhat) can control their mind. Further dialogue clarifies what constitutes a learned monk, a monk with quick wisdom, and a monk with clever and swift understanding, emphasizing truthful knowledge of suffering and acting with compassion to benefit others."
1217,罵意經,T 732,$nti/t0732_01.txt,"This text discusses various Buddhist concepts related to karma, moral conduct, and the path to enlightenment. It outlines the consequences of both good and bad deeds, emphasizing the importance of ethical behavior and mental discipline. It also describes different realms of existence and the factors that influence rebirth. Ultimately, the text guides practitioners towards detachment from worldly desires and the cultivation of wisdom to break free from the cycle of suffering and achieve liberation."
1223,法觀經,T 611,$nti/t0611_01.txt,"This text discusses the practice of meditation and the importance of mindfulness, particularly focusing on observing the breath and contemplating the impermanence of the body. It emphasizes the need to control the body, speech, and mind to achieve a state of meditative stillness and overcome desires. By diligently practicing these techniques, one can understand the nature of suffering, the illusion of the self, and ultimately attain enlightenment by recognizing the emptiness of all things. The text also explores contemplating the body's impurities and decay to detach from worldly attachments and seek liberation."
1224,身觀經,T 612,$nti/t0612_01.txt,"This text is a Buddhist discourse on the impermanence and impurity of the human body. It emphasizes the body's fragility, filled with unpleasant substances and prone to disease and decay, contrasting it with the delusion of pleasure and attachment. The teaching urges practitioners to contemplate the body's true nature to overcome desires and attachments, recognizing that all worldly possessions and pleasures are fleeting and ultimately unsatisfying in the face of death. Ultimately, the text suggests that one should focus on cultivating virtue and wisdom, understanding the body's inherent limitations."
1227,伏婬經,T 65,$nti/t0065_01.txt,"The Buddha, while in Jetavana, was asked by Anathapindika about the types of ways to subdue or control money. The Buddha describes ten ways people handle wealth, ranging from acquiring it through unlawful means and not using it for good, to acquiring it lawfully and using it for personal benefit, charitable giving, or both. The best way involves lawful acquisition, benefiting oneself and others, and detachment from the wealth with the understanding that it is transient. The Buddha emphasizes that the wise person acts with knowledge and contentment, using resources without greed."
1228,離睡經,T 47,$nti/t0047_01.txt,"The Buddha finds Maudgalyayana sleeping while meditating and advises him on methods to overcome sleepiness, including reciting scriptures, washing with cold water, paying attention to surroundings, and lying down mindfully. He further cautions Maudgalyayana against seeking worldly validation or engaging in arguments, and emphasizes the importance of solitude, meditation, and mindful eating. The Buddha concludes by explaining how a monk can achieve complete purity by observing the impermanent nature of pain and detaching from worldly attachments."
1229,應法經,T 83,$nti/t0083_01.txt,"The Buddha taught the monks about the nature of the world, where people often indulge in sensual pleasures, leading to the decline of good and the increase of evil. He described four types of actions: those that bring pleasure now but suffering later, those that bring suffering now but pleasure later, those that bring suffering now and later, and those that bring pleasure now and later. The wise discern these consequences and choose actions that lead to the decrease of evil and the increase of good, ultimately leading to enlightenment and Nirvana."
1230,樂想經,T 56,$nti/t0056_01.txt,"The Buddha taught that those who cling to the elements (earth, water, fire, wind) or states of being (heavens, Brahma heavens) as ""self"" are ignorant. True understanding comes from not delighting in these elements or states, nor identifying them as ""self."" Furthermore, enlightened beings transcend the cycle of birth and death by understanding and not clinging to these concepts as ""self."" Ultimately, the Buddha emphasizes detaching oneself from these attachments to achieve true knowledge and liberation."
1231,尊上經,T 77,$nti/t0077_01.txt,"The Buddha is residing in the Jeta Grove when a monk named Luo-ye Qiang-qi is visited by a radiant celestial being who recites a verse about not dwelling on the past or future, but is unable to explain its meaning. The celestial being directs Luo-ye Qiang-qi to the Buddha to learn the verse's true significance. Luo-ye Qiang-qi travels to the Buddha, recounts his encounter, and asks the Buddha to explain the verse for the benefit of all monks. The Buddha then elucidates the verse, explaining how to avoid attachment to the past, future, and present."
1234,柔軟經,T 26 (117),taisho/t0026_n117.txt,"The Buddha recounts his life of extreme luxury before his renunciation, detailing the palaces, gardens, and servants dedicated to his pleasure. He recalls an experience of observing farmers and meditating under a Jambu tree, attaining the first Jhana, and contemplating the universality of sickness, aging, and death. He reflects on how foolish it is to scorn these conditions in others when one is also subject to them, emphasizing the importance of recognizing and accepting these truths. He concludes that those who are ignorant are arrogant and attached to desire and fail to walk the path of Brahmacharya."
1237,處處經,T 730,$nti/t0730_01.txt,"This text, attributed to the Buddha, discusses various aspects of Buddhist practice, including controlling anger, the significance of offerings, and the qualities leading to fearlessness. It also delves into the reasons behind the Buddha's actions and physical attributes, such as why he didn't wear shoes or fly. The text further explores the differences between Arhats, Pratyekabuddhas, and Buddhas, and the importance of mindfulness, detachment, and ethical conduct for achieving enlightenment."
1238,閑居經,T 154 (13),taisho/t0154_n13.txt,"The Buddha, while traveling with a large group of monks, arrives at a town where a respected Brahmin elder hears of his presence and seeks him out. The Brahmin asks the Buddha who is worthy of offerings and respect. The Buddha explains that those who are not attached to sensory pleasures and worldly desires are worthy of reverence, while those still seeking such things are not. The Brahmin affirms this and declares his faith in the Buddha, his teachings, and his monastic community, becoming a lay follower."
1239,何苦經,T 26 (148),taisho/t0026_n148.txt,"The Buddha is visited by a Brahmin who asks about the hardships and happiness of laypeople and those who have left the household life to follow the path. The Buddha explains that laypeople suffer from a lack of freedom when they are unable to prosper, while renunciates suffer from the freedom to indulge in negative emotions. Conversely, laypeople find happiness in the freedom to prosper, while renunciates find happiness in the discipline of restraining negative impulses. The Buddha further advises that harmony between humans and the heavens brings prosperity and that one should view bad company like a waning moon and good company like a waxing moon."
1241,貧窮經,T 26 (125),taisho/t0026_n125.txt,"The Buddha addresses monks, highlighting the great suffering caused by poverty, debt, accruing interest, and being pursued and ultimately seized by creditors. He explains that even with material wealth, a person lacking faith, morality, learning, generosity, and wisdom is truly impoverished in the context of sacred law. The text draws parallels between these worldly hardships and the suffering caused by unwholesome actions and thoughts, ultimately leading to rebirth in lower realms. The Buddha concludes by contrasting this with the liberation attained through faith, virtue, and the practice of meditation, leading to a state of peace and freedom from suffering."
1242,求欲經,T 49,$nti/t0049_01.txt,"The Buddha explains to Śāriputra that people can be categorized based on whether they have desires and whether they are aware of those desires. Those who have desires but are unaware of them, or those who lack desires but are unaware of that lack, are considered the worst. Conversely, those who have desires and are aware of them, or those who lack desires and are aware of that lack, are considered the best. The discourse further elaborates on how desires can lead to negative actions and suffering, while their absence, coupled with awareness, promotes positive actions and well-being, using analogies such as dirty and clean bowls."
1243,分別經,T 738,$nti/t0738_01.txt,"The Buddha explains the causes of suffering and how people are deceived by their senses and worldly desires, leading to negative consequences and rebirth in lower realms. He outlines different ways people engage with Buddhism, distinguishing between those who are truly devoted, those who are influenced by worldly desires, and those who follow the path correctly. The text also warns of a future decline in Buddhist practice, characterized by corruption and a focus on material gain rather than spiritual development, emphasizing the importance of upholding precepts and seeking enlightenment. It concludes by highlighting the difficulties of attaining human birth and encountering Buddhist teachings, stressing the need for diligence in practice and adherence to the principles of morality and compassion."
1246,慢法經,T 739,$nti/t0739_01.txt,"The text explains why some people who follow Buddhism become wealthy while others experience misfortune. It states that true followers find enlightened teachers, uphold Buddhist precepts, and dedicate themselves to practice, thus earning protection and prosperity. Conversely, those who lack faith, disrespect the teachings and scriptures, engage in harmful actions, and seek help from other deities will suffer misfortune and negative consequences. The misfortunes are not caused by the Buddha but are a result of their own negative actions and lack of genuine faith."
1247,邪見經,T 93,$nti/t0093_01.txt,"Shortly after the Buddha's passing, Venerable Ananda is visited by a former associate who questions him about the Buddha's teachings on rejecting wrong views. The man specifically asks if the Buddha dismissed views about the permanence and limits of the world, the relationship between body and soul, and the afterlife. Ananda confirms that the Buddha, possessing wisdom and insight, did indeed reject these wrong views because they lead to specific consequences and a particular kind of rebirth. Impressed, the man declares his refuge in the Buddha, the Dharma, and the Sangha, becoming a lay follower."
1251,積骨經,T 150A (30),taisho/t0150a_n30.txt,"The Buddha, speaking to monks, explains that the bones collected from even a single lifetime's worth of deaths could equal the size of a mountain. Even those who have lived through hundreds or thousands of lifetimes have yet to achieve enlightenment. The Buddha urges the monks to eradicate the root cause of suffering and attachment to the world. By eliminating this fundamental evil, they can escape the cycle of birth and death and attain Nirvana."
1252,苦陰經,T 53,$nti/t0053_01.txt,"The Buddha, residing in Jetavana, was approached by monks discussing challenges posed by those of different doctrines. These individuals claimed their understanding of sensual pleasure (lust) and form (physical appearance) was equal to the Buddha's. The Buddha then explained the allure, corruption, and means of abandonment concerning sensual pleasure, form, and feelings (pain), emphasizing that true understanding leads to liberation from suffering. He explained the impermanence and potential for suffering of sensual pleasure and form, and described the value of the four levels of meditation."
1254,灌臘經,T 391,$nti/t0391_01.txt,"The Buddha, while in Jetavana Vihara, explains the purpose of ""pouring wax"" (灌臘) ceremonies held on the 8th day of the 4th month and the 15th day of the 7th month to Ananda. These ceremonies are for generating merit, either for oneself to escape worldly suffering or to liberate deceased relatives trapped in unfortunate realms. The Buddha warns against promising donations for these ceremonies and then failing to deliver, outlining dire consequences. Finally, the Buddha instructs that the offerings should be distributed amongst the monastic community or, in their absence, given to the poor."
1255,受歲經,T 50,$nti/t0050_01.txt,"The Buddha, while at the Bamboo Garden, instructs the monks to guide and support new members, particularly those with good qualities who are receptive to teaching. He contrasts those who are difficult to teach, driven by negative qualities like greed and anger, with those who are open and virtuous. Monks should examine themselves, striving to cultivate positive attributes like gratitude and avoid harmful behaviors. Just as one uses a mirror to see and remove impurities from the face, monks should reflect on their actions to purify themselves and achieve enlightenment."
1257,腹使經,T 154 (28),taisho/t0154_n28.txt,"During a time of famine, the Buddha stayed in a country where the rice was expensive and people were starving. Ananda convinced the king to provide food and medicine to the Buddha and his monks for three months. The Buddha then recounted a past life where Ananda, as a poor man, cleverly persuaded a king to provide him with food during a similar famine, highlighting Ananda's consistent ability to find compassionate solutions in times of need. The Buddha encouraged his monks to learn from Ananda's skillful and kind communication."
1260,持齋經,T 26 (202),taisho/t0026_n202.txt,"The text recounts a dialogue where the Buddha explains the different types of fasting to a laywoman. He distinguishes between inferior types of fasting, like those of herdsmen or non-Buddhists, and the superior ""Noble Eightfold Fast,"" which involves abstaining from killing, stealing, unchastity, lying, intoxicants, luxurious beds, entertainment, and untimely eating. Furthermore, practitioners of the Noble Eightfold Fast should cultivate mindfulness of the Buddha, the Dharma, the Sangha, their own moral conduct, and the virtues of the devas. The Buddha emphasizes the immense benefits of the Noble Eightfold Fast, which far outweigh worldly riches and lead to rebirth in higher realms."
1261,盂蘭經,T 685,$nti/t0685_01.txt,"The text describes a scene where Maudgalyayana, a disciple of the Buddha, uses his supernatural powers to discover his deceased mother suffering in the realm of hungry ghosts. Unable to help her alone, the Buddha instructs him to make offerings to the monastic community on the fifteenth day of the seventh month, a practice called the Ullambana, to liberate not only his mother but also ancestors from suffering. This act of offering and seeking blessings from the monastic community can bring benefits to both living and deceased parents and relatives, granting them happiness and freedom from hardship. The Buddha encourages all disciples to follow this practice as an act of filial piety and to remember their parents with gratitude."
1265,恒水戒經,T 33,$nti/t0033_01.txt,"The Buddha, surrounded by disciples and a large assembly, arrives at the Ganges River. During a discourse, the Buddha explains the difficulty of obtaining human form, encountering the Buddha's teachings, entering the Buddhist path, and upholding its precepts. He emphasizes the importance of adhering to the precepts, comparing the consequences of violating them to various unpleasant analogies, and highlights that the Buddha Dharma does not increase or decrease with followers. The Buddha stresses the rarity and importance of the sutras and states that he will not discourse on them anymore."
1266,寂志果經,T 22,$nti/t0022_01.txt,"King Ajatasattu of Magadha, troubled by persistent unease, seeks advice from his court on how to alleviate his worries. After several suggestions, the physician Jivaka suggests visiting the Buddha, which the king agrees to. The king consults the Buddha on whether worldly pursuits and offerings lead to enlightenment, revealing his previous unsuccessful inquiries with other teachers who offered nihilistic or confusing answers. The Buddha then elucidates the path to enlightenment through virtuous living, ethical conduct, meditation, and the relinquishment of worldly attachments, and conversion of the king."
1273,戒消災經,T 1477,$nti/t1477_01.txt,"A man traveling abroad breaks his vow to abstain from alcohol and is banished by his parents. He finds refuge in another country, where the host worships three powerful but malevolent spirits. Through the traveler's adherence to the remaining four of the five precepts of Buddhism, the spirits are driven away, and the host is inspired to take refuge in the Buddha. The duo later encounters 498 people, and they all return to the Buddha and become enlightened."
1277,法滅盡經,T 396,$nti/t0396_01.txt,"The Buddha, nearing his Nirvana, foretells the decline of Buddhist Dharma. He describes an era characterized by moral decay, selfish monks, and a lack of genuine practice, with women being more devoted than men. Natural disasters and shortened lifespans will occur as the Dharma fades, with scriptures disappearing and monastic robes turning white. Eventually, Maitreya will appear and restore peace and prosperity to the world after a long period of decline."
1286,是我所經,T 154 (5),taisho/t0154_n05.txt,"The Buddha recounts the story of a wealthy but miserly man who hoarded his vast fortune, neglecting his family, and failing to make charitable donations. This man's behavior is compared to a bird in a past life who jealously guarded medicinal fruits, only to have them taken away by others. The Buddha emphasizes that such attachment to wealth is futile because upon death, one cannot take their possessions with them. Instead, the Buddha advises his disciples to cultivate virtue, practice generosity, and purify their minds to prepare for the afterlife, unlike the man who will face regret at the end of his life."
1287,阿耨風經,T 58,$nti/t0058_01.txt,"The Buddha, after bathing with Ananda, discusses the fate of Devadatta, stating he is destined for hell due to the complete absence of any redeeming qualities. He then proceeds to explain the characteristics of different types of individuals based on their potential for good or evil, focusing on how their thoughts and actions lead to either increasing virtue or increasing vice. The discourse outlines six types of people, categorizing them based on whether their good or bad qualities will increase, decrease, or lead to ultimate liberation."
1293,惟日雜難經,T 760,$nti/t0760_01.txt,"This text discusses the practices and intentions of Bodhisattvas, contrasting them with those of Arhats. It outlines the different stages and paths towards enlightenment, highlighting the importance of compassion, wisdom, and skillful means for Bodhisattvas aiming to liberate all beings. It emphasizes that Bodhisattvas delay their own liberation to help others and cultivate virtues like giving, morality, and patience to attain Buddhahood. Certain obstacles and beneficial practices for achieving enlightenment are identified, alongside characteristics that distinguish Bodhisattvas from those seeking individual liberation."
1298,內身觀章經,T 610,$nti/t0610_01.txt,"The text explores the impermanence and ultimately unsatisfactory nature of the physical body, describing it as a collection of impermanent parts and processes, prone to decay and suffering. It emphasizes that clinging to the body as ""self"" is a source of delusion and that true wisdom lies in recognizing its inherent emptiness. The text also identifies eleven conditions that hinder enlightenment, advising practitioners to avoid them in order to progress on the path to liberation."
