CSZJJ No.,CSZJJ Title,Taisho No.,File,Summary
1,四十二章經,T 784,$nti/t0748_01.txt,"After the Han Emperor had a dream of a golden deity, he sent envoys to retrieve Buddhist scriptures. The scriptures outline the path to enlightenment, emphasizing the importance of ethical conduct, detachment from desire, and diligent practice. It provides guidance on how to live as a Buddhist monk, focusing on abstaining from worldly desire and embracing the path of virtue. Finally, the text highlights the rarity and difficulty of encountering the Buddha's teachings and emphasizes the importance of focused effort to attain enlightenment."
3,陰持入經,T 603,taisho/t0603.txt,"This Buddhist scripture discusses the concepts of five aggregates (skandhas), eighteen elements (dhatus), and twelve entrances (ayatanas) as fundamental to understanding the path to enlightenment. It details practices like the Four Right Exertions and the Thirty-Seven Limbs of Enlightenment, emphasizing mindfulness, contemplation, and detachment from worldly desires. The text highlights the importance of recognizing impermanence, suffering, and non-self to overcome ignorance and attachment. Ultimately, the goal is to achieve liberation from suffering through the cessation of these aggregates, elements, and entrances, leading to a state of perfect peace (nirvana)."
7,大道地經,T 607,$nti/t0607_01.txt,"This text outlines a path to enlightenment by detailing what practices are beneficial and detrimental, categorizing individuals based on their progress, and describing the necessary states of mind. It emphasizes the importance of abandoning worldly attachments and cultivating virtues like mindfulness and compassion. The text also delves into the nature of the five aggregates (skandhas) that constitute human experience: form, feeling, perception, mental formations, and consciousness; and how understanding and managing these aggregates is crucial for spiritual advancement. Furthermore, the text describes the cycle of death and rebirth, highlighting how one's actions in life influence their experiences in future existences."
8,人本欲生經,T 14,$nti/t0014_01.txt,"In this sutra, the Buddha addresses Ānanda, explaining the origin and interconnectedness of suffering. He describes a chain of causation that begins with desire and leads to suffering, old age, and death, emphasizing that without the initial cause, there can be no subsequent suffering. The Buddha then elaborates on how clinging to different perceptions of the self, whether through the body, feelings, or consciousness, perpetuates this cycle. Finally, he outlines ways to achieve liberation through wisdom and detachment from these perceptions, emphasizing the importance of understanding the nature of consciousness and the eight stages of liberation."
10,阿毘曇五法經,T 1557,$nti/t1557_01.txt,"This text outlines five elements of Dharma practice: form, intention, thought, differentiated intention and action, and non-action. It describes how understanding suffering, its origins, its cessation, and the path to its cessation leads to wisdom and liberation from the cycle of suffering. The text further elaborates on various aspects of these elements, including the different types of attachments, bonds, and defilements that hinder spiritual progress. Ultimately, it aims to guide practitioners toward a state of detachment and enlightenment through understanding the impermanence and emptiness of all phenomena."
13,十報經,T 13,taisho/t0013.txt,"In a garden in the country of Savatthi, a wise one addresses the monks, urging them to listen to the Dharma, which progresses from one to ten, encompassing virtuous conduct, mindfulness, and insight. The teachings elaborate on progressively larger sets of practices and concepts, such as the one to ten aspects of action, two ways to improve conduct, three types of sensations, and so on. The ultimate goal of these practices is to achieve liberation from suffering and attain enlightenment through diligent practice and the development of wisdom."
14,普法義經,T 98,$nti/t0098_01.txt,"The text details various practices and contemplations for Buddhist practitioners, focusing on achieving enlightenment and liberation from suffering. It outlines the importance of listening to the Dharma, engaging in virtuous conduct, and cultivating mindfulness. Specific practices like contemplation on impurity, impermanence, and death are described, alongside warnings against unwholesome thoughts and behaviors. Ultimately, the text aims to guide practitioners toward purification of mind, liberation from worldly attachments, and the attainment of Nirvana."
16,漏分布經,T 57,$nti/t0057_01.txt,"The text presents the Buddha's teachings on understanding the nature, origin, consequences, distribution, cessation, and path to ending various forms of suffering. It specifically addresses ""leaks"" (desires, attachments), pain, thoughts, love and lust, actions, and suffering itself. For each, it outlines the path to liberation through understanding their nature and origin, as well as practicing the Eightfold Path (right understanding, thought, speech, action, livelihood, effort, mindfulness, and concentration). Ultimately, the text guides practitioners towards detachment from the world and the attainment of a pure, enlightened state free from these sources of suffering."
17,四諦經,T 32,$nti/t0032_01.txt,"The Buddha taught the four noble truths: suffering, the origin of suffering, the cessation of suffering, and the path to the cessation of suffering. Suffering arises from birth, aging, sickness, death, and other forms of unpleasant experiences and is perpetuated by attachment and craving.  Liberation from suffering is achieved by eliminating these attachments and cravings, leading to a state of peace and detachment. The path to liberation involves cultivating right understanding, thought, speech, action, livelihood, effort, mindfulness, and concentration."
18,七處三觀經,T 150A,$nti/t0150a_01.txt,"This text contains a series of teachings from the Buddha, delivered in the Jetavana Grove in Sravasti, addressing monks on various topics related to Buddhist practice. It explores subjects like understanding the seven aspects of existence and the three contemplations, guarding one's mind and senses, practicing generosity, avoiding negative actions, and cultivating virtuous qualities. The Buddha emphasizes the importance of mindfulness, ethical conduct, and wisdom for liberation from suffering and achieving enlightenment. Ultimately, these teachings offer guidance for monks to live a mindful and virtuous life, leading to spiritual progress and freedom from the cycle of rebirth."
19,九橫經,T 150B,$nti/t0150b_01.txt,"The Buddha describes nine causes of untimely death that can be avoided. These causes include improper eating habits, lack of self-control, ignoring bodily needs, breaking moral precepts, associating with bad influences, acting inappropriately in public, and failing to avoid dangerous situations. By understanding and avoiding these causes, people can prolong their lives and gain the opportunity to learn and practice the dharma. The teachings were well-received by the monks."
20,八正道經,T 112,$nti/t0112_01.txt,"The Buddha taught his disciples about the Eightfold Path, distinguishing it from the ""wrong path."" The Eightfold Path consists of right understanding, thought, speech, action, livelihood, effort, mindfulness, and concentration, all focused on abandoning negativity and cultivating wisdom.  Each element of the path emphasizes virtuous conduct and detachment from worldly desires.  Following the Eightfold Path leads to liberation and the ability to guide others to enlightenment."
22,五十校計經,T 397 (13),$nti/t0397_59.txt,"The Buddha, surrounded by bodhisattvas and deities, is visited by buddhas from the four directions in a golden pavilion. The Sun and Moon Deities ask the Buddha and bodhisattvas how to obtain the ""Torch of Wisdom Dharani,"" which can bring light to all beings and dispel darkness. Together, the buddhas and bodhisattvas then recite the dharani. It's said to be a rare and powerful mantra that can liberate beings from even the deepest hells and protect those who hear and recite it."
23,大安般經,T 602,taisho/t0602.txt,"This text describes the practice of *Ānāpānasati*, or mindfulness of breathing, as a path to liberation. It outlines various stages and techniques, including counting breaths, focusing on different sensations, and contemplating the impermanence of the body and mind. The text emphasizes the importance of controlling the mind, abandoning attachments, and cultivating wisdom to overcome suffering and achieve enlightenment. Ultimately, it presents *Ānāpānasati* as a means to understand the nature of reality and break free from the cycle of rebirth."
26,五陰喻經,T 105,$nti/t0105_01.txt,"The Buddha teaches the impermanence and insubstantiality of the five aggregates (form, feeling, perception, mental formations, and consciousness) using metaphors like foam, bubbles, mirages, banana trees, and illusions. These aggregates are not real, strong, or permanent, but rather sources of suffering, emptiness, and impermanence.  He urges monks to diligently observe these aggregates with wisdom, understand their transient nature, and strive for liberation through the cessation of these aggregates. By cultivating mindfulness and wisdom, one can realize true peace and happiness by transcending the illusion of self."
27,轉法輪經,T 109,$nti/t0109_01.txt,"The Buddha, residing in a deer park, addressed gathered monks and deities about the path to liberation. He explained the Middle Way, avoiding extremes of indulgence and self-denial, and introduced the Four Noble Truths: the existence of suffering, its cause in attachment, its cessation through detachment, and the path to cessation through the Eightfold Path. As the Buddha taught, many attained enlightenment, and the Dharma's influence resonated throughout the cosmos, shaking the heavens and benefiting countless beings."
28,流攝經,T 31,$nti/t0031_01.txt,"This text details the Buddha's teachings on how to end the ""flows"" (of suffering), by stopping desire and ignorance through wisdom and mindfulness. It describes methods for ending these flows, including ending them through insight, restraint, avoidance, proper use, endurance, awareness, and developing good conduct. By ending these flows, one can break free from worldly attachments, overcome suffering, and achieve liberation."
29,是法非法經,T 48,$nti/t0048_01.txt,"This text contrasts the behavior of ""wise"" monks with that of ""unwise"" monks. It states that unwise monks boast and deceive others based on superficial qualities like lineage, appearance, eloquence, knowledge, or ascetic practices. Wise monks, however, focus on cultivating inner virtues like detachment from desire, hatred, and delusion, regardless of their external attributes or achievements and do not boast or deceive. The text concludes by urging monks to reflect on these distinctions, abandon unwise behaviors, and embrace the path of the wise through righteous conduct."
30,法受塵經,T 792,$nti/t0792_01.txt,"The Buddha teaches monks in the Jeta Grove about how people become defiled by worldly desires, leading to suffering and preventing them from attaining enlightenment. He explains that attachment to the sensual pleasures of sight, sound, smell, taste, and touch, whether directed towards men or women, results in endless striving and pain. Therefore, the Buddha advises against being deluded and stained by these sensory experiences and encourages awareness. Ultimately, the audience rejoices and commits to practicing these teachings."
32,本相猗致經,T 36,$nti/t0036_01.txt,"The Buddha explains that suffering arises from a chain of causes rooted in ignorance and attachment, starting from association with the unwise and culminating in worldly desire. This cycle involves a decline through unethical actions, lack of mindfulness, and ultimately, the manifestation of suffering. Conversely, liberation and wisdom are achieved through a path that begins with associating with the wise, leading to faith, mindfulness, ethical conduct, and the development of the seven factors of enlightenment. This path ultimately results in liberation from suffering and attaining a state of enlightenment."
33,阿鋡口解,T 1508,$nti/t1508_01.txt,"This text explains the twelve conditions (因緣) that lead to the cycle of birth and death, emphasizing the importance of understanding and breaking free from them to achieve liberation. It connects these internal conditions to external elements and relates them to both human and universal existence. The text also discusses the origins of these conditions, linking them to negative behaviors and thoughts, and proposes ways to eliminate them by focusing on mindfulness of impermanence and ceasing negative actions.  Furthermore, it explores various aspects of human existence, including the body's components, desires, relationships, and the causes of suffering."
35,禪行法想經,T 605,$nti/t0605_01.txt,"The Buddha, residing in the Garden of Jeta Grove, instructed the monks on various forms of contemplation to cultivate diligent meditation. He emphasized the importance of contemplating death, impermanence, suffering, and emptiness, as well as reflecting on the repulsive nature of the body and the world. By contemplating these things, one can detach from worldly desires and realize nirvana."
38,般若道行品經,T 224 (1),$nti/t0224_01.txt,"This text is an excerpt from the ""Perfection of Wisdom Sutra"" (般若波羅蜜) where Buddha speaks to Subhuti on the nature of bodhisattvas and the practice of wisdom. Subhuti explains that a bodhisattva doesn't dwell on conventional concepts like form, sensation, or consciousness, because ultimate reality is emptiness and non-attachment. He also discusses how a Bodhisattva should act and think. The text emphasizes the importance of understanding the ungraspable nature of reality for achieving enlightenment."
38,般若道行品經,T 224 (2),$nti/t0224_02.txt,"The Buddha explains to celestial beings and his followers the merits and protective power of studying, upholding, and reciting the Perfection of Wisdom (Prajnaparamita). He emphasizes that those who engage with the Prajnaparamita are protected from harm and negativity, and that even a copy of the text holds great power and receives reverence from celestial beings. The Buddha illustrates the immense merit of honoring the Prajnaparamita by comparing it to making offerings to countless Buddha relics and constructing numerous jeweled stupas, stating the former generates more blessing. Ultimately, the Buddha highlights that all Buddhas emerge from the Prajnaparamita, making it the most supreme path to enlightenment and worthy of the highest respect."
38,般若道行品經,T 224 (3),$nti/t0224_03.txt,"This text discusses the immense merit of encouraging others to perform virtuous deeds, especially in the context of seeking enlightenment (Anuttara-samyak-sambodhi). It highlights that the merit of such encouragement surpasses even the merit of performing those deeds oneself or of making offerings to countless Buddhas and Bodhisattvas. The text cautions against seeking enlightenment with attachment or preconceived notions, emphasizing the importance of non-attachment and understanding the emptiness (sunyata) of all phenomena for realizing wisdom (prajna paramita) and attaining enlightenment. It also warns against slandering or hindering the teaching of prajna paramita, as such actions lead to dire consequences, while faith and proper understanding of emptiness are crucial for progress on the path."
38,般若道行品經,T 224 (4),$nti/t0224_04.txt,"This Buddhist text profoundly elucidates the Perfection of Wisdom (Prajnaparamita), describing it as inherently pure, limitless, and the ultimate path to supreme enlightenment. It asserts that future Buddhas will also teach this wisdom, emphasizing its invaluable nature and the immense benefits and protection afforded to those who diligently practice it. However, the text also extensively warns of numerous subtle obstacles and demonic interferences that practitioners may face, urging them to recognize these hindrances and remain steadfast on the Bodhisattva path, rather than diverting towards lesser spiritual goals."
38,般若道行品經,T 224 (5),$nti/t0224_05.txt,"This text explores the profound meaning of the Perfection of Wisdom (Prajnaparamita) through a dialogue between the Buddha and Subhuti. It describes how the Tathagata (Buddha) illuminates the world with Prajnaparamita, particularly in understanding the nature of the five aggregates and the inherently empty nature of all phenomena. The text emphasizes that those who seek enlightenment should cultivate Prajnaparamita to avoid falling into the paths of Arhats or Pratyekabuddhas, and that true enlightenment is achieved through the realization of the fundamental non-existence (本無) of all things. Ultimately, Prajnaparamita enables the Tathagata to attain complete enlightenment and guide others towards liberation."
38,般若道行品經,T 224 (6),$nti/t0224_06.txt,"This text discusses the characteristics and qualities of an *avaivartika* Bodhisattva, one who will not regress from the path to enlightenment. It describes how they remain steadfast in their practice despite demonic illusions and temptations, and that they are devoted to the profound *prajna paramita*, and are fearless in the face of adversity. It ends by highlighting the story of a laywoman who, after hearing the teachings, receives a prophecy from the Buddha regarding her future attainment of Buddhahood."
38,般若道行品經,T 224 (7),$nti/t0224_07.txt,"This text discusses the practice of emptiness (śūnyatā) within the context of the Perfection of Wisdom (Prajñāpāramitā) for Bodhisattvas, emphasizing the importance of not becoming attached to emptiness or seeking personal liberation. It describes the characteristics of an ""Avaivartika"" Bodhisattva, one who will not regress from the path to Buddhahood, and warns against succumbing to the illusions and temptations presented by demons that could lead to premature enlightenment in the Hinayana paths, such as Arhatship or Pratyekabuddhahood. The discourse highlights the significance of engaging with beneficial spiritual friends, understanding emptiness, and practicing compassion for all beings to attain the supreme enlightenment of Buddhahood."
38,般若道行品經,T 224 (8),$nti/t0224_08.txt,"In this chapter of the Perfection of Wisdom Sutra, the importance of upholding and studying the profound Perfection of Wisdom is emphasized, even over observing the ten precepts. A celestial being highlights that a bodhisattva practicing the Perfection of Wisdom surpasses not only humans and deities but also those who have attained lesser states of enlightenment like Arhats and Pratyekabuddhas. The text further explores how demons try to hinder bodhisattvas from achieving Buddhahood by creating distractions and doubts, especially targeting those who lack faith or associate with unskillful teachers. Finally, the text emphasizes that a bodhisattva who practices the Perfection of Wisdom, understanding the emptiness of all phenomena and tirelessly working for the benefit of all beings, is protected by all Buddhas and will swiftly attain enlightenment."
38,般若道行品經,T 224 (9),$nti/t0224_09.txt,"This text emphasizes the importance of the Prajñāpāramitā (Perfection of Wisdom) teachings, stating that those who uphold, learn, and follow it are as if seeing the Buddha face to face and are destined for enlightenment. It instructs Ananda to prioritize teaching the Prajñāpāramitā to bodhisattvas over helping others achieve Arhatship, highlighting the profound merit derived from even a short reflection on its principles. The text further uses the story of Bodhisattva Sadāprarudita as an example of how to dedicate one's life and sacrifice all for the sake of learning Prajñāpāramitā."
38,般若道行品經,T 224 (10),$nti/t0224_10.txt,"The bodhisattva Sadāparibhūta and 500 women waited patiently for seven years outside the palace for the bodhisattva Dharmodgata to emerge from meditation. During this time, evil forces attempted to sabotage preparations for Dharmodgata's teaching by defiling the seats and preventing the gathering of water.  Sadāparibhūta and the women selflessly used their own blood to purify the ground, impressing Indra, who then miraculously provided pure water and a jeweled landscape. When Dharmodgata finally arose, he expounded on the nature of Prajñāpāramitā (perfection of wisdom), leading to enlightenment and predictions of future Buddhahood for Sadāparibhūta and the women."
40,般舟般三昧經,T 418 (1),$nti/t0418_01.txt,"The Buddha is residing in a place with a large gathering of various beings, including monks, nuns, bodhisattvas, kings, gods, and dragons. A bodhisattva named 颰陀和 respectfully asks the Buddha about a specific type of Samadhi (meditative state) and its benefits, such as wisdom, clairvoyance, and virtuous qualities. The Buddha explains the ""Present Buddha Standing Before One's Eyes Samadhi,"" detailing the practices and conditions necessary to attain it, emphasizing the importance of mindfulness of the Buddha. The text also discusses the merits of upholding this Samadhi, contrasting it with those who denigrate it, and uses parables to illustrate its profound value."
40,般舟般三昧經,T 418 (2),$nti/t0418_02.txt,"This text focuses on the practice of a specific Samadhi (state of meditative consciousness) and its benefits. It emphasizes the importance of pure conduct, respect for teachers, and detachment from worldly desires for practitioners seeking this Samadhi.  Various types of practitioners (monks, nuns, laypeople) are given tailored guidance, with assurances that the Samadhi brings protection, admiration, and ultimately, the path to enlightenment. It mentions a past life story of a practitioner that would become a Buddha in the future and emphasizes the importance of upholding this Samadhi in order to reach enlightenment."
40,般舟般三昧經,T 418 (3),$nti/t0418_03.txt,"A bodhisattva named Bhadraka requests the Buddha and his disciples for a meal, which is accepted, and preparations are made with assistance from deities. During the meal, the Buddha expands the host's home through divine power and after the meal, he explains to Bhadraka and other bodhisattvas how to quickly attain the Samadhi of visualizing Buddhas, emphasizing detachment, generosity, and diligent practice of the teachings. The Buddha recounts past lives where he encountered this Samadhi, highlighting its power to lead to enlightenment and urging disciples to seek out and honor teachers of this Samadhi, as its merit far exceeds material offerings."
42,方等部古品曰遺日說般若經,T 350,$nti/t0350_01.txt,"This sutra, spoken by the Buddha, outlines practices that diminish or increase a bodhisattva's wisdom, prevent progress on the bodhisattva path, or ensure continued progress towards enlightenment. It emphasizes respecting teachers and the Dharma, generously sharing knowledge, avoiding pride and deceit, and cultivating compassion and ethical conduct. The text also contains instructions for monks and explains the characteristics of true and false practitioners, as well as the nature of emptiness and non-attachment as essential for liberation. Lastly, the sutra details how to cure ailments from greed to ignorance using Buddhist principles."
44,阿闍世王經,T 626 (1),$nti/t0626_01.txt,"This text recounts a gathering at Vulture Peak Mountain where the Buddha is surrounded by monks, bodhisattvas, and various celestial beings.  During the gathering, Manjushri Bodhisattva is present with twenty-five other advanced bodhisattvas and several deities and they discuss achieving ultimate wisdom.  Each member presents their own insights on cultivating the mind and actions necessary to reach enlightenment, emphasizing virtues like compassion, equanimity, and detachment. Eventually, Manjushri gives a longer speech emphasizing avoiding attachments and recognizing the inherent emptiness of all phenomena."
44,阿闍世王經,T 626 (2),$nti/t0626_02.txt,"This text details a discourse by a great enlightened being on the profound Dharma, including the concept of ""Dharani"" as the origin of the path and the ""Bodhisattva Treasury"" as a repository of all phenomena. The discourse further explores the ""Wheel of Non-Regression"" and its role in liberation, as well as the complexities of karma and the potential for even those who commit heinous acts to attain enlightenment. It concludes with predictions of future Buddhas and the enduring benefits of studying and practicing the Dharma, emphasizing the importance of faith, understanding, and diligent practice for achieving ultimate liberation."
46,問署經,T 458,$nti/t0458_01.txt,"Sariputra asks the Buddha about the meaning of ""Tathāgata-samjñā,"" which involves the concept of 'signatures.' The Buddha explains that these signatures have four aspects: the initial aspiration, irreversibility, the Bodhisattva's seat under the tree, and the perfection of Buddhist teachings. The Buddha details how to study the signatures, emphasizing detachment from all phenomena and cultivating a mind that is free from discrimination and clinging, embodying the Tathāgata's teachings. Various monks and lay practitioners express their understanding and commitment to learn the Tathāgata-samjñā, emphasizing its vastness and importance for liberation and benefiting all beings."
