CSZJJ No.,CSZJJ Title,Taisho No.,File,Summary
1050,婆羅門子命終愛念不離經,T 91,$nti/t0091_01.txt,"The sutra recounts a story where a grieving Brahmin, distraught over the death of his son, is told by the Buddha that love inevitably leads to sorrow. The Brahmin initially disagrees, finding support for his view among some entertainers, leading to a debate that reaches King Pasenadi. The King initially doubts the Buddha's teaching, but Queen Mallika uses examples of the King's attachments to demonstrate that loss or change of those loved invariably leads to sorrow. King Pasenadi is eventually convinced and declares the Buddha as his teacher, taking refuge in the Buddha, Dharma and Sangha."
1052,婆羅門避死經,T 131,$nti/t0131_01.txt,"The Buddha recounts a story of four Brahmin hermits who, fearing death, sought refuge in different places using their advanced spiritual powers (five supernatural powers): one in the sky, one in the ocean, one in a mountain cave, and one underground. However, death found them in each of these places. The Buddha, observing this, teaches that there is no place in the sky, sea, mountain, or earth that can escape death."
1061,佛為黃竹園老婆羅門說學經,T 75,$nti/t0075_01.txt,"In this Buddhist scripture, the Buddha is in the Yellow Bamboo Grove when an elderly Brahmin approaches him and criticizes him for not showing proper respect. The Buddha responds by stating that he does not show respect because he has overcome the causes of such behavior. He describes his path to enlightenment, including the attainment of the four levels of meditation and the three insights (knowledge of past lives, the ability to see the destiny of beings, and the extinction of outflows) which led him to liberation from suffering. Impressed by the Buddha's profound understanding, the Brahmin expresses his faith, takes refuge in the Buddha, Dharma, and Sangha, and vows to abstain from killing."
1069,審裸形子經,T 154 (27),taisho/t0154_n27.txt,"The Buddha recounts a story where a naked ascetic, born from a Brahmin woman and a king, sends his four sisters to test the Buddha's teachings. However, the sisters are converted and praise the Buddha, angering the ascetic who accuses them of being deceived. The Buddha then relates a past life story where a king named Kalin sent four women to test another king named Aji, but Aji prevailed due to his wisdom and the support of his minister, Shariputra, just as the Buddha now prevails with the help of his disciples. The Buddha identifies the characters from the past life as the present-day ascetic, himself, Shariputra, and Ananda, emphasizing the continuity of their roles and relationships."
1077,仙人撥劫經,T 154 (52),taisho/t0154_n52.txt,"The Buddha recounts a story about a former life of Sariputta, named the ascetic Bōjié (撥劫), who had supernatural powers granted by ascetic practices, and was highly respected by a king. While the king was away, the ascetic succumbed to lust upon touching the king's daughter, losing his powers. The king, upon returning, confronted him, and the ascetic, filled with shame, regained his powers through diligent effort. The Buddha concludes that the king in the story was himself, and the ascetic was Sariputta, illustrating that even those who have achieved much can still be susceptible to temptation."
1078,五仙人經,T 154 (11),taisho/t0154_n11.txt,"The Buddha recounts a past life where he was a servant to four ascetics. Due to a mistake, they cursed him, leading to his rebirth as a king after death. A brahmin, previously respected by the king, became arrogant, prompting the king to initially exile him. Later, the brahmin found a jeweled shoe from the king's past life, which was offered back to the king."
1082,光華梵志經,T 154 (14),taisho/t0154_n40.txt,"The Buddha, residing at Jetavana Monastery, was surrounded by a large assembly of monks, bodhisattvas, and other beings. Ananda inquired about the past deeds of these monks, who had renounced worldly life, developed supernatural powers, and attained enlightenment. The Buddha explained that in a previous era, during the time of the Buddha Vipassi, a Brahmin named Guanghua, along with a king and a wealthy man, led their followers to renounce their lives and become monks; through their devotion and good deeds over 91 kalpas, they were reborn in heaven and as humans, and eventually joined the Buddha's sangha, achieving enlightenment."
1095,梵志計水淨經,T 510,$nti/t0051_01.txt,"The Buddha, after achieving enlightenment, encounters a Brahman who believes in purification through water rituals. The Buddha explains that true purification comes from abandoning 21 defilements that lead to suffering and cultivating virtues like loving-kindness, compassion, joy, and equanimity. He emphasizes that external cleansing is ineffective against inner impurities, and that virtuous conduct is the path to true liberation. The Brahman, convinced by the Buddha's teachings, takes refuge in the Buddha, Dharma, and Sangha, vowing to abstain from killing."
1105,前世諍女經,T 154 (7),taisho/t0154_n07.txt,"The Buddha recounts a story from a past life to explain Devadatta's animosity towards him. Long ago, a wealthy Brahmin offered his beautiful daughter to the most knowledgeable scholar among 500. Although an older scholar was initially chosen, a younger, wiser scholar ultimately won her hand, enraging the older man who vowed revenge in future lives. The Buddha reveals that the older scholar was Devadatta, the younger was himself, and the woman was his disciple Goyi, thus explaining the origin of Devadatta's lifelong hatred."
1106,三摩竭經,T 129,$nti/t0129_01.txt,"This text recounts the story of Samagga, a wise woman from a Buddhist kingdom, who marries the king of a heretical nation. The king, proud of his own wisdom and devoted to naked ascetics, is challenged by Samagga's superior knowledge of Buddhism. She eventually invites the Buddha and his disciples to her husband's kingdom, leading to the conversion of many to Buddhism after they are convinced by the Buddha's miraculous display of power and teachings."
1112,釋家畢罪經,T 152 (54),taisho/t0152_n54.txt,"The text describes the downfall of the Shakya clan due to past karma and the resulting suffering of King Virudhaka. The king, influenced by advisors and seeking revenge for past slights, massacres the Shakya people. Despite the Buddha's efforts and interventions, he cannot prevent the inevitable consequences of their accumulated misdeeds. The story emphasizes the importance of ethical conduct, the inescapable nature of karma, and the compassion of the Buddha."
1115,殺身濟賈人經,T 152 (67),taisho/t0152_n67.txt,"In a past life, the Bodhisattva sailed with 500 merchants, but their ship was threatened by a storm and an angry sea god. Realizing the sea god detested corpses, the Bodhisattva sacrificed himself by bleeding into the sea, appeasing the god and saving the merchants. Moved by his sacrifice, the god Indra revived the Bodhisattva with divine medicine and filled the ship with treasure, leading to prosperity and the spread of Buddhist teachings. The Buddha then reveals that he was that Bodhisattva and Maitreya was Indra in the story."
1116,殺龍濟一國人經,T 152 (70),taisho/t0152_n70.txt,"In a past life, two Bodhisattva brothers vowed to save a kingdom plagued by a dragon and its harmful influence, leading the people to abandon the Buddha's teachings. Recognizing the immense suffering the dragon caused, the elder brother convinced the younger that killing the dragon to save the nation, although seemingly against Buddhist principles, was necessary to prevent greater sin. The brothers transformed into a lion and an elephant and sacrificed their lives to defeat the dragon. Deeply moved by their sacrifice, the kingdom embraced Buddhism, leading to peace and prosperity, and the brothers were reborn in a higher realm. The Buddha reveals that he was the elder brother, Maitreya was the younger brother, and Devadatta was the dragon in that lifetime, emphasizing the importance of striving for boundless compassion."
1118,懈怠耕者經,T 827,$nti/t0827_01.txt,"While traveling to a new destination with his disciples and celestial beings, the Buddha noticed a farmer delaying his visit to the Buddha due to his unfinished work. Knowing the farmer's heart, the Buddha emitted light and explained to Ananda that this farmer had repeatedly missed opportunities to be liberated by previous Buddhas because of his laziness and attachment to worldly tasks. Hearing this, the farmer abandoned his work, approached the Buddha with remorse, and received teachings on the importance of diligence, ultimately attaining enlightenment."
1122,善生子經,T 17,$nti/t0017_01.txt,"The Śālistamba Sūtra tells the story of a young man named Shan Sheng, who, following his father's deathbed instructions, ritually worships the six directions. Buddha encounters him and explains the true meaning of honoring the six directions, which involves avoiding vices like killing, stealing, and associating with bad friends. Buddha then elaborates on proper conduct and relationships, offering advice on how to treat parents, teachers, spouses, friends, and servants, as well as how to interact with religious figures, all of which leads to prosperity and a good life."
1123,尸迦羅越六向拜經,T 16,$nti/t0016_01.txt,"In the Śrāvakabhūmi Sūtra, the Buddha encounters a man named Śrāvakabhūmi who is performing a six-directional bowing ritual taught by his late father. The Buddha explains that the true meaning of this practice lies not in the physical act but in cultivating ethical conduct and fulfilling one's responsibilities towards parents, teachers, spouses, friends, servants, and religious figures, each direction representing these relationships. He details specific duties and virtues relevant to each of these relationships, emphasizing moral behavior and mutual respect. The sutra concludes with verses urging diligence, ethical conduct, and devotion to the Buddha's teachings for a better life and liberation."
1129,貧窮老公經,T 797,$nti/t0797a_01.txt,"This text, the ""Buddha Speaks of the Poor Old Man Sutra,"" tells the story of an incredibly old and impoverished man who seeks to see the Buddha. After initial resistance, the Buddha allows him entry and reveals the man's past life as a wealthy prince who denied a humble monk (now the future Buddha Maitreya) basic necessities, leading to his current suffering. The Buddha emphasizes the karmic consequences of greed and the merit of saving lives, then grants the old man ordination and spiritual insight. Finally, the Buddha extols the virtues of reciting and practicing this sutra."
1130,老母經,T 561,$nti/t0561_01.txt,"While in a kingdom, the Buddha was approached by a poor old woman who questioned him about the origins and destinations of life, the senses, and the elements. The Buddha explained that all things arise and cease due to causes and conditions, lacking inherent origin or destination, using analogies like fire from wood and sound from a drum. The woman, enlightened by the Buddha's teachings, rejoiced and later, at the end of her life, will be reborn in Amitabha Buddha's realm, eventually becoming a Buddha herself."
1132,負為牛者經,T 154 (39),taisho/t0154_n39.txt,"The Buddha encounters a distressed bull being led to slaughter, who recognizes him from a past life. The bull approaches the Buddha seeking help, revealing that it is repaying a debt from a past life where the Buddha, as a king, failed to fully compensate the bull, who was then a creditor. The Buddha then intervenes, offering to repay the bull's value in gold, but ultimately, the gods provide the payment. After experiencing the glory of the Buddha and his teachings, the bull dies, is reborn in heaven, and returns to earth to honor the Buddha, ultimately attaining enlightenment."
1135,阿遬達經,T 141,$nti/t0141_01.txt,"The Buddha teaches about the immense debt children owe their parents, emphasizing that material gifts cannot repay their kindness. Instead, children should guide their parents away from harmful actions and towards virtue, lest they fall into lower realms after death. The Buddha then visits the home of a wealthy man named Sudatta, whose daughter-in-law, Yuye, is disrespectful. The Buddha instructs Yuye on the proper duties of a wife, outlining three evils and four virtues in serving her husband, leading her to become a respectful and dutiful wife."
1136,樹提伽經,T 540,$nti/t0540a_01.txt,"The Buddha recounts the story of a wealthy man named Shutijia, whose possessions far exceeded even the king's. Intrigued and envious, the king visited Shutijia's home with a large entourage, experiencing incredible luxury and splendor. The king, tempted to seize Shutijia's wealth, attempted to attack his home, but was thwarted by a powerful guardian. Ultimately, Shutijia and the king went to the Buddha, who revealed that Shutijia's great fortune was the result of past charitable deeds."
1137,鞞摩肅經,T 90,$nti/t0090_01.txt,"The Buddha is visited by a non-Buddhist named Vema Suku, who asserts that physical form (rupa) is the most supreme. The Buddha challenges this assertion by showing how light can outshine light, and then argues that attachment to the five senses leads to lust and desire. Vema Suku, initially angry and defiant, is eventually converted and gains insight into the Dharma. He then requests to become a monk and ultimately attains enlightenment."
1140,那賴經,T 154 (1),taisho/t0154_n01.txt,"A man became a monk, but his beautiful wife remarried, causing him to constantly think of her and lose his focus on spiritual practice, even leading him to return home. The Buddha, after hearing of this, teaches the monk about the fleeting and harmful nature of desire, contrasting it with the peace of enlightenment. He relates a past life where he, as a sage named Narayana, taught King Fangji the insatiable nature of desire, leading the king to renounce worldly pleasures and attain enlightenment. This shows that the monk's current struggle is a continuation of past patterns, and only the Buddha's teachings can liberate him from the attachments of lust."
1142,大意經,T 177,$nti/t0177_01.txt,"The Buddha recounts the story of a prince named Great Intent (大意) who, upon birth, vowed to alleviate the suffering of the world through generosity. He journeys to sea to collect treasures for distribution and encounters multiple jeweled cities, each guarded by a serpent, where he obtains luminous pearls. When a sea god steals the pearls, Great Intent's determination to retrieve them moves even the gods, leading to their return and enabling him to fulfill his vow of universal generosity."
1144,申日兜本經,T 536,$nti/t0536_01.txt,"The Buddha, residing in a kingdom where his teachings are revered, is invited to a meal by a wealthy man named Shen Ri, who is influenced by other religious practitioners to test the Buddha's omniscience by poisoning the food and setting a trap. Shen Ri's son, a believer in the Buddha, warns against this, but is ignored. However, the Buddha, aware of the plot, transforms the trap into a lotus pond and removes the poison from the food, demonstrating his power and compassion. Shen Ri, witnessing this miracle, repents, converts to Buddhism, and takes the five precepts."
1148,舅甥經,T 154 (12),taisho/t0154_n12.txt,"The Buddha tells a story of a resourceful nephew who repeatedly steals from the king's treasury with his uncle. Despite the king's elaborate traps and schemes, the nephew consistently outsmarts him to protect himself and his uncle, even after the uncle's death. Eventually, the nephew gains power in another kingdom and asks to marry the king's daughter, leading to his eventual capture and marriage due to his remarkable intelligence. The Buddha then reveals the identities of the characters in the story, connecting them to his past life and family."
1149,越難經,T 537,$nti/t0537_01.txt,"In a kingdom, a wealthy but greedy man named 越難 is reborn as a blind beggar after death as punishment for his lack of generosity. One day, while begging, he is severely beaten by his own son from his previous life, who is also greedy. Moved by the suffering, the Buddha arrives and restores the blind beggar's sight, revealing his past life and the consequences of his actions, and teaches that wealth is impermanent and should be used for good, and that not doing so leads to suffering."
1151,鸚鵡經,T 79,$nti/t0079_01.txt,"The Buddha visits the home of a man named Parrot, where he encounters Parrot's dog. After the Buddha tells the dog that he used to be a chanting Brahmin, Parrot becomes angry and confronts the Buddha. The Buddha reveals that the dog was Parrot's father in a past life and challenges Parrot to test the truth of his statement. Parrot finds hidden wealth as a result of the Buddha's challenge, gains faith, and asks about the reasons for inequalities among people, to which the Buddha explains how actions and intentions lead to different outcomes in life and rebirth."
1153,水牛王經,T 154 (30),taisho/t0154_n30.txt,"The Buddha recounts a past life as a water buffalo king who, along with his herd, endures abuse from a mischievous monkey without retaliation, showing great patience. A tree spirit questions the buffalo's forbearance. Later, the monkey's actions lead to his demise at the hands of passing ascetics. The Buddha explains that this story illustrates the consequences of both good and bad deeds, emphasizing that even as a bodhisattva, he practiced patience, which ultimately led to his enlightenment."
1155,兔王經,T 154 (31),taisho/t0154_n31.txt,"The Buddha recounts a past life as a rabbit king who, along with his community, diligently provided food for a forest-dwelling hermit, deeply respecting his spiritual practice. When the hermit announced his departure due to the winter's harshness, the rabbit king, in a display of utmost devotion, offered his own body as sustenance, throwing himself into a fire. This selfless act led to his rebirth in a heavenly realm, while the hermit, profoundly moved, also passed away and was reborn in the same realm. The Buddha then reveals that he was the rabbit king, his disciples were his former community, and the hermit was an earlier Buddha, using this story to inspire his followers to pursue enlightenment through diligent effort and detachment."
1156,拘薩羅國烏王經,T 154 (47),taisho/t0154_n47.txt,"The Buddha, while visiting Jetavana, encountered four ministers preparing for war on behalf of King Pasenadi. The ministers explained their duty to the king and their fear of the dangers ahead. The Buddha then recounted a story from the past where four crows risked their lives to fulfill the unusual request of their queen, who craved deer meat, demonstrating exceptional loyalty. The Buddha revealed that the ministers were the crows in a past life, King Pasenadi was their king, and the soldiers were the crows under his command, highlighting the themes of loyalty and service."
1157,雀王經,T 152 (51),taisho/t0152_n51.txt,"In the past, the Buddha was born as a king of sparrows and helped all living beings with a compassionate heart. Seeing a tiger suffering from a bone stuck in its teeth, the sparrow repeatedly pecked at the bone to remove it, injuring itself in the process. The sparrow then preached to the tiger about the evils of killing and the importance of compassion. The tiger, unrepentant, was angered by the sparrow's words, leading the sparrow to abandon it."
1158,孔雀經,T 154 (51),taisho/t0154_n51.txt,"The Buddha, while in the Garden of Jeta, overheard his disciples marveling at how his emergence had eclipsed other teachings. He then told a story of a land that initially revered crows until peacocks arrived, captivating everyone and causing the crows to be forgotten, much like how the Buddha's teachings outshine other doctrines. The Buddha revealed that he was the peacock in the story, Ananda was the observing god, and the crows represented the other schools of thought, emphasizing the completeness and purity of his teachings compared to others."
1159,野雞經,T 154 (6),taisho/t0154_n06.txt,"The Buddha recounts a past life where he was a wild hen and a deceitful cat attempted to seduce her with sweet words. The cat, hungry and wanting to eat the hen, tried to lure her down from the tree by promising marriage and companionship. The hen, wise and aware of the cat's true nature, rebuffed its advances with clever verses, recognizing the danger. The Buddha reveals that the cat was a past incarnation of a malicious contemporary monk, highlighting how similar their deceptive natures were across lifetimes."
1165,大魚事經,T 216,$nti/t0216_01.txt,"The Buddha recounts a story of fish: large fish warned small fish against leaving their area, but they disobeyed and were caught. This parallels a monk who, despite warnings from senior monks to control his desires, succumbed to lust after seeing beautiful women while begging for food. Consequently, he abandoned his monastic vows and returned to lay life, highlighting the dangers of unchecked desires and the importance of renouncing worldly temptations. The Buddha urges the monks to relinquish acquired gains and avoid greed for those yet to be acquired."
1169,蠱狐烏經,T 154 (25),taisho/t0154_n25.txt,"The Buddha recounts a story from the past where a crow and a fox praised each other while feeding on a discarded corpse, each exaggerating the other's virtues. A nearby sage, witnessing this, rebuked them for their insincere flattery and their consumption of unclean food. The Buddha reveals that the crow represents Kokalika, the fox represents Devadatta, and the sage represents a bodhisattva, highlighting that their current mutual admiration, despite lacking merit, mirrors their past behavior. This emphasizes the foolishness of praising those who are unworthy."
1174,犢子經,T 808,$nti/t0808_01.txt,"When the Buddha was ill and needed milk, Ananda was sent to a Brahmin household to ask for some. A fierce cow was offered, but Ananda hesitated to milk it himself. Through divine intervention and a transformed Brahmin, the milk was obtained, and the calf expressed its joy at offering its share of milk to the Buddha, seeing it as a means to enlightenment after many lifetimes of suffering due to disbelief. The Buddha then prophesied that both the cow and calf would achieve enlightenment in future lives as a result of their meritorious act."
1175,驢駝經,T 154 (50),taisho/t0154_n50.txt,"A newly ordained monk mistreated an elder monk after being prematurely granted lodging rights. The Buddha recounts a past life story of a foolish Brahman who trusted a thief, ignoring warnings from his companions, and was subsequently robbed and injured. The Buddha reveals that the Brahman was the elder monk, the thief was the newly ordained monk, the companions were the other monks, and he himself was a deva who witnessed the Brahman's misfortune. The Buddha warns against trusting those whose intentions are unclear and ignoring wise counsel."
1177,猘狗經,T 214,$nti/t0214_01.txt,"On the fifteenth day of the lunar month, the Buddha delivered precepts at Vulture Peak. This sutra is one of the teachings spoken on that day. The term ""mad dog"" refers to a rabid dog that continues barking uncontrollably even when restrained. This sutra recounts the circumstances and story involving such a mad dog, using it as a metaphor: one who receives precepts from a teacher but later slanders and speaks ill of that teacher behaves like a mad dog that turns and bites its own master."
1180,鱉獼猴經,T 154 (10),taisho/t0154_n10.txt,"The Buddha recounts a story from a past life where he was a monkey king befriended by a turtle. The turtle's wife, suspecting infidelity, feigns illness and demands the monkey's liver as a cure. The turtle tricks the monkey, revealing the plot mid-journey, but the clever monkey claims to have left his liver hanging on a tree and escapes. The Buddha reveals that the turtle's wife was a malicious nun, the turtle was Devadatta, and the monkey king was himself."
1185,鬼問目連經,T 734,$nti/t0734_01.txt,"The text describes Maudgalyayana (目連), a disciple of the Buddha, encountering various hungry ghosts (餓鬼) near a river and inquiring about the reasons for their suffering. Each ghost recounts their past misdeeds, such as mistreating others, being greedy, or harming living beings. Maudgalyayana explains that their current suffering is the karmic consequence of those actions, highlighting the principle of cause and effect. The consequences are described as ""flower rewards"" that lead to rebirth in hell."
1191,鐵城泥犁經,T 42,$nti/t0042_01.txt,"The Buddha describes observing people's deaths, some ascending to heaven and others descending into hell (Naraka) based on their actions, speech, and thoughts in life. Those who were unkind, disrespectful, and did evil deeds are judged by Yama, the king of hell, and questioned about their failings in life. Subsequently, they endure horrific tortures in various hells within an iron city, facing fire, sharp mountains, and flesh-eating insects, experiencing prolonged suffering. The text ends by saying those who do good works can avoid these hell realms."
