CSZJJ No.,CSZJJ Title,Taisho No.,File,Summary
1299,忠心政行經,T 743,$nti/t0743_01.txt,"The Buddha tells a group of monks, bodhisattvas, and other followers about five internal ""thieves"" and five external deceptions that lead people to evil paths. He emphasizes the importance of focusing the mind, understanding the cycle of suffering (twelve causes and conditions), and practicing mindfulness to escape the cycle of rebirth. The Buddha instructs them to contemplate their bodies, sensations, thoughts, and laws, and to cultivate compassion towards all beings, ultimately achieving enlightenment and liberation from suffering."
1301,罪業報應經,T 747a,$nti/t0747a_01.txt,"The Buddha, while at a large tree, explains to Ananda the relationship between one's actions and their resulting rewards or punishments in future lives. Virtuous deeds like generosity, upholding precepts, and practicing patience lead to positive outcomes such as wealth, longevity, and beauty, while negative actions like anger, stealing, and harming others result in suffering and undesirable rebirths. The Buddha emphasizes the importance of personal effort in accumulating merit and cautions against laziness, highlighting that good and bad deeds inevitably follow a person like a shadow. He concludes by stating that understanding this cycle of cause and effect leads to enlightenment and liberation from suffering."
1304,摩訶剎頭經,T 696,$nti/t0696_01.txt,"According to the Buddha, all Buddhas are born, renounce worldly life, achieve enlightenment, and reach nirvana on the eighth day of the fourth month. This day is auspicious because it is a time of renewal and harmony, free from harsh weather and rampant disease. People should commemorate the Buddha's virtues by bathing Buddha images, which is believed to bring immense blessings and fulfill various desires, from spiritual enlightenment to worldly prosperity and long life."
1308,金剛清淨經,T 644,$nti/t0644_01.txt,"The Buddha is residing in a grand hall surrounded by a large assembly of monks, bodhisattvas, deities, and other beings. Maitreya Bodhisattva asks the Buddha about entering the Samadhi of All Powers (Shurangama Samadhi), and how to cultivate wisdom to attain the Diamond Samadhi and achieve enlightenment. The Buddha explains the stages of bodhisattva development and details the 100 Samadhis, which are essential for entering the Diamond Samadhi. The Buddha concludes by emphasizing the benefits of hearing, practicing, and sharing this teaching, promising future encounters with Buddhas and bodhisattvas for those who embrace it."
1317,淨除業障經,T 1494,$nti/t1494_01.txt,"The Buddha is residing in a garden and teaching a large assembly of monks and bodhisattvas when a monk named Immaculate Light breaks a vow after being tricked by a courtesan. Overcome with guilt, he seeks guidance from Manjushri Bodhisattva and ultimately the Buddha. The Buddha teaches him, and the assembly, that all phenomena are like dreams and illusions, lacking inherent existence and therefore free from defilement and karmic consequences. Immaculate Light understands the teaching, rejoices, and is prophesied to become a future Buddha."
1322,相應相可經,T 111,$nti/t0111_01.txt,"The Buddha addresses the monks, stating that people with similar qualities tend to congregate, correspond, and harmonize with each other. He provides various examples of this principle, contrasting those who are unlearned with the learned, the greedy with the generous, and the ethical with the unethical. The Buddha advises the monks to discern these relationships and to practice what is right and avoid what is wrong."
1323,商人求財經,T 26 (136),taisho/t0026_n136.txt,"The Buddha recounts a story of merchants who set sail to find treasure, only to be shipwrecked and lured to an island of beautiful, but dangerous, demon women. A wise merchant discovers the women are cannibalistic and learns from other captured merchants that a magical horse can help them escape. The horse warns that only those who can resist the allure of the women and their treasures can ride it to safety, otherwise, they will fall and be devoured. The Buddha uses this story as a metaphor for monks who must resist attachment to the self (eyes, ears, thoughts etc.) and the world (colors, sounds etc.) to achieve enlightenment and avoid being consumed by suffering."
1329,前世三轉經,T 178,$nti/t0178_01.txt,"The Buddha, in the presence of a large assembly, emits radiant light and smiles, prompting Ananda to inquire about the reasons behind this extraordinary display. The Buddha recounts a past life where he was a woman who sacrificed her breasts to feed a starving mother, later transformed into a man-king who ruled with righteousness and generosity, and finally, as a Brahmin who offered his body to a starving tiger. This story illustrates the Buddha's past lives of intense devotion and self-sacrifice, emphasizing the immense merit gained through acts of generosity and compassion."
1338,阿含正行經,T 151,$nti/t0151_01.txt,"The Buddha teaches the monks about the five internal ""thieves"" and the importance of controlling the senses and mind to avoid suffering and negative rebirths. He explains the cycle of dependent origination and emphasizes the significance of ethical conduct, mindfulness, and concentration in achieving liberation from the cycle of birth and death. The Buddha urges the monks to purify their minds, practice diligently, and cultivate compassion for all beings to attain enlightenment and escape the suffering of the five realms."
1347,父母恩難報經,T 684,$nti/t0684_01.txt,"The Buddha teaches that children can never fully repay the great kindness of their parents who nurtured them. He explains that even carrying one's parents for a thousand years, even if they were to soil one's back, would be insufficient repayment. Rather, children can best repay their parents by guiding them to faith, morality, knowledge, generosity, and ultimately to believe in the Buddha, the Dharma, and the Sangha, leading them to enlightenment and a higher spiritual path."
1359,犯戒罪報輕重經,T 1467,$nti/t1467a_01.txt,"The Buddha, residing in the Bamboo Grove at Rajagrha, answers a question from Maudgalyayana about the consequences of monks and nuns violating monastic rules due to a lack of shame and respect for the Buddha's teachings. The Buddha explains that different levels of transgression, such as violating minor or major precepts, result in vastly different periods of suffering in hell realms, equivalent to immense spans of human years. Maudgalyayana expresses joy and then recites a verse highlighting the relationship between actions and their consequences, emphasizing the importance of observing precepts to avoid suffering and attain liberation."
1360,大乘方等要慧經,T 348,$nti/t0348_01.txt,"The text recounts a dialogue between the Buddha and the Bodhisattva Maitreya in the kingdom of Shravasti. Maitreya asks the Buddha how a Bodhisattva can attain non-regression on the path to enlightenment, advance in the Mahayana teachings, subdue demonic forces, understand the nature of all things, and quickly achieve supreme wisdom. The Buddha praises Maitreya's question and explains that a Bodhisattva equipped with eight qualities can swiftly attain supreme enlightenment. These eight qualities include inner purity, accomplished conduct, accomplished giving, accomplished vows, compassion, loving-kindness, skillful means, and wisdom."
1363,仁王護國般若波羅蜜經,T 245,taisho/t0245.txt,"The scripture details the benefits of reciting the Prajna Paramita Sutra for protecting a country from various calamities and for personal well-being, recounting stories of kings who averted disaster through its recitation. It emphasizes the importance of supporting and respecting the fourfold Buddhist community and warns against actions by rulers or monastic communities that could lead to the decline of Buddhist teachings and societal harmony. The text also describes the transformative power of understanding emptiness and practicing compassion, as well as the importance of wisdom for achieving enlightenment and benefiting all beings."
1364,阿難陀目佉尼呵離陀經,T 1013,$nti/t1013A_01.txt,"This text presents a Dharani, or a sacred incantation, associated with the Bodhisattva Avalokitesvara, who embodies great compassion. The Dharani is a string of Sanskrit mantras intended to invoke the bodhisattva's power and offer protection from various fears and calamities. It includes praises and specific sounds designed to bring about auspiciousness and the fulfillment of wishes. It concludes with a section on offering food, signifying generosity and compassion towards all beings."
1388,四品學法經,T 771,$nti/t0771_01.txt,"This text categorizes Buddhist practice into four levels: true learning, upholding the precepts, relying on blessed precepts, and detached service. True learning, characterized by full precepts, knowledge of scriptures, and the ability to convert others, is considered the highest. The text outlines the qualities and virtues associated with each level, emphasizing that even detached service, though not a formal precept, is significantly better than ordinary life. Ultimately, the text encourages practitioners to strive for higher levels of practice to escape suffering and attain liberation."
1390,四未曾有法經,T 136,$nti/t0136_01.txt,"The Buddha describes four unprecedented qualities possessed by a Wheel-Turning King: being loved by the people like a father, bringing joy to the people when seen, providing teachings that are endlessly appreciated, and giving instructions that the people eagerly follow. These four qualities are then mirrored in the Venerable Ananda, who brings joy and endless satisfaction with his teachings to monks, nuns, laymen, and laywomen. The sutra highlights Ananda's popular appeal and skill in delivering the Dharma to various audiences within the Buddhist community. The text is intended to praise Ananda by comparing his virtues to those of an ideal righteous ruler."
1392,四人出現世間經,T 127,$nti/t0127_01.txt,"The Buddha teaches King Pasenadi about four types of people in the world, categorized by their initial and final states in life, focusing on their actions and attitudes towards others. These categories are: those who start poor and end well through good deeds, those who start rich and end poorly due to bad actions, those who start and end poorly, and those who start and end well. The Buddha emphasizes the importance of virtuous behavior, respect for others, and generosity, leading to a favorable rebirth, while condemning evil actions and wrong views which lead to suffering. The King is encouraged to emulate those who are good in the beginning and end, avoiding those who are bad in the beginning and end."
1397,七寶經,T 26 (58),taisho/t0026_n058.txt,"The text recounts the Buddha explaining to monks that just as the emergence of a Wheel-Turning King is accompanied by the appearance of seven treasures, so too is the emergence of a Tathagata accompanied by the appearance of seven factors of enlightenment. These seven treasures of enlightenment are mindfulness, investigation of the dharma, energy, joy, tranquility, concentration, and equanimity. The Buddha emphasizes the importance of these factors for those seeking enlightenment."
1406,十二遊經,T 195,$nti/t0195_01.txt,"This text recounts the story of a Bodhisattva who, as a former king, renounced his throne to seek enlightenment, adopting a Brahmin's way of life and name. He was later wrongly accused of robbery and sentenced to death, prompting the Brahmin to miraculously create two children from the Bodhisattva's blood. The narrative then shifts to describing the lineage of kings and the gradual decline of human lifespan, culminating in the future Buddha's decision to be reborn into the family of King Suddhodana, foreshadowing his birth and early life."
1408,十二頭陀經,T 783,$nti/t0783_01.txt,"The text describes the origin and exposition of the twelve ascetic practices (dhuta) for monks dwelling in solitary places. The Buddha explains to Mahākāśyapa the benefits and details of these practices, which include living in remote areas, begging for food, eating only one meal a day, wearing patched robes, dwelling in cemeteries or under trees, and abstaining from lying down. The practices are meant to detach from worldly desires, purify the mind, and advance on the path to enlightenment."
1413,慈仁問八十種好經,T 2867,taisho/t2867.txt,"The text explains the causes and conditions for the Buddha's eighty kinds of excellent characteristics. It details how specific virtuous actions and mental states in past lives lead to particular physical perfections in the Buddha's present form. These actions include generosity, kindness, upholding precepts, and teaching others. Ultimately, the text illustrates how moral conduct and compassionate intentions cultivate exceptional qualities."
1416,寶積三昧文殊師利菩薩問法身經,T 356,$nti/t0356_01.txt,"The Buddha, while residing at Mount Gijjhakuta, engages in a dialogue with Manjushri Bodhisattva about the nature of the ""Treasure Accumulation"" Samadhi and the Dharmakaya (Dharma Body). Manjushri questions the Buddha on various aspects of the Dharmakaya, including its characteristics, its relationship to the world, and its connection to concepts like nirvana and enlightenment. Sariputra later joins the conversation, and Manjushri questions him to determine his understanding of the Dharmakaya. The text concludes by emphasizing the merit of propagating this Dharma, highlighting its profound meaning despite its concise form."
1418,自誓三昧經,T 622,$nti/t0622_01.txt,"When the Buddha entered a meditative state, countless Buddhas from other worlds sent bodhisattvas with lotus flowers as offerings, praising the Buddha's achievements and foretelling his future Buddhahood and benefit to sentient beings. The Buddha smiled, emitting light that illuminated all worlds, enabling beings to see their past lives and awakening their aspiration for enlightenment. The Buddha then explained three reasons for a Buddha's smile, highlighting the bodhisattvas' advanced spiritual progress, dedication to liberating beings, and imminent incarnation as a Buddha."
1419,佛印三昧經,T 621,$nti/t0621_01.txt,"The Buddha, surrounded by a vast assembly of monks, bodhisattvas, and other beings, enters a profound meditative state (samadhi) that makes his physical form disappear. This event prompts questions from bodhisattvas like Maitreya, who seek to understand the nature of the Buddha's samadhi. The Buddha reveals that this samadhi is difficult to encounter and comprehend, but those who embrace it and the wisdom it represents will swiftly attain enlightenment and Buddhahood, while those who doubt it will suffer greatly. Embracing the teaching brings great blessings, leading to celestial and earthly rebirths, and ultimately Buddhahood."
1420,法華三昧經,T 269,$nti/t0269_01.txt,"The Buddha is in a mountain surrounded by disciples when he emits a great light, causing confusion and wonder among the assembly. A princess named Profit Practice asks the Buddha about the nature of this light and the path to achieving such a state. The Buddha explains the Lotus Flower Samadhi and the means to attain it, emphasizing understanding the illusory nature of existence and practicing detachment from desires. Ultimately, many in the assembly, including the princess (who transforms into a man), and a king and his son, achieve enlightenment and dedicate themselves to spreading the Dharma, leading to widespread transformations and spiritual awakening."
1421,月燈三昧經,T 640,$nti/t0640_01.txt,"The Buddha, while in Jetavana, teaches Manjushri and a large assembly about ten aspects of practice for bodhisattvas. These aspects include generosity, keeping precepts, patience, diligence, meditation, wisdom, understanding, upholding the Dharma, practicing emptiness, solitary practice, secluded practice and proper conduct. Each of these practices are further described with ten specific qualities or benefits. Upon hearing this discourse, many individuals achieve enlightenment and the assembly rejoices in the Buddha's teachings."
1427,禪要呵欲經,T 609,$nti/t0609_01.txt,"This text discusses methods for practitioners to overcome desires while seeking enlightenment through meditation. It advises cultivating pure faith and戒, then eliminating desires related to form, appearance, demeanor, speech, and physical sensations by contemplating the impurity of the body. This involves contemplating the decaying corpse and one's own body as a collection of impure substances, encouraging disgust and detachment. The text also emphasizes reflecting on the impermanence of life and the necessity of diligently subduing the mind to escape suffering."
1438,水喻經,T 26 (4),taisho/t0026_n004.txt,"The Buddha describes seven types of people using the metaphor of someone in water, ranging from those submerged to those who have crossed to the far shore. These stages represent spiritual progress, from being consumed by negativity and lacking faith, to achieving enlightenment and liberation from suffering. The path involves developing faith, practicing good deeds, understanding suffering and its causes, and ultimately breaking free from worldly attachments to reach a state of complete liberation. The monks, upon hearing this teaching, rejoice and practice accordingly."
1443,群牛譬經,T 215,$nti/t0215_01.txt,"The Buddha tells a story of an ass who tries to imitate well-behaved cattle by eating soft grass and drinking clean water, but is rejected by them because it cannot truly be like them. Similarly, a corrupt monk may try to imitate virtuous monks in their practices and demeanor to gain material benefits, but is ultimately exposed and expelled from their community. The Buddha advises monks to abandon non-virtuous practices and diligently cultivate virtuous ones. This story emphasizes the importance of genuine practice and the rejection of hypocrisy within the monastic community."
1447,鼈喻經,T 154 (35),taisho/t0154_n35.txt,"A giant turtle, mistaken for land by merchants, is disturbed and burned by their activities. In pain, it plunges into the ocean, drowning the merchants and their animals. This parable represents people in the three realms, the five aggregates, and the twelve links of dependent origination, suffering due to the fires of the three poisons. The Buddha, with his wisdom, comes to rescue people from this suffering, obscured by their sins, and guides them towards enlightenment."
1449,箭喻經,T 94,$nti/t0094_01.txt,"A monk questions the Buddha about various metaphysical issues, such as the permanence of the world and the nature of life after death, stating he will only follow the Buddha if he provides definitive answers. The Buddha rebukes the monk, pointing out he never promised such answers and that dwelling on these questions is like refusing to remove a poisoned arrow until one knows every detail about it. The Buddha emphasizes that the important thing is to address the suffering at hand, focusing on understanding and ending suffering, rather than getting caught up in unproductive speculation."
1451,毒喻經,T 154 (37),taisho/t0154_n37.txt,"A family known for using poison to gain wealth was ostracized by their community, unable to find spouses for their children. Eventually, they found a bride from a poor family in another country unaware of their practices. The bride was pressured to continue the family's tradition of poisoning, but refused. Tormented by a manifestation of the poison spirit, she was eventually rescued by her parents who forced the husband's family to abandon their poisonous ways to keep her."
1462,阿彌陀佛偈,T 1978,$nti/t1978_01.txt,"This is a hymn in praise of Amitabha Buddha, expressing reverence and the desire to be reborn in the Pure Land. It repeatedly praises Amitabha's qualities, particularly the immeasurable light, and describes the wonders of the Pure Land. The hymn also seeks blessings for oneself and all beings to be reborn in that blissful realm. Finally, the hymn praises Bodhisattvas in the Pure Land."
1463,後阿彌陀佛偈,T 373,$nti/t0373_01.txt,"This text describes the vows and virtues of a past monk who became a Buddha with immeasurable light and life. It details the pure and joyful land he resides in, filled with fragrant trees and rivers that sing like scriptures. The poem emphasizes the importance of faith in this Buddha, warning against doubt and encouraging devotion to be reborn in his blessed realm. Finally, it urges followers to protect the Buddha's teachings, especially in times of decline, and to practice diligently for boundless blessings."
1471,灌頂七萬二千神王護比丘呪經,T 1331 (1),$nti/t1331_01.txt,"While traveling, the Buddha noticed distressed monks who were being harassed by various beings and sought guidance. To help them, the Buddha taught them protective mantras, consisting of the names of numerous divine kings and their retinues. These mantras were said to ward off evil, ensure safety, and bring good fortune to those who recited them. The Buddha instructed that these powerful teachings should only be shared with virtuous individuals who uphold Buddhist precepts and compassion."
1472,灌頂十二萬神王護比丘尼呪經,T 1331 (2),$nti/t1331_02.txt,"The Buddha, dwelling in a garden, addressed concerns about seven nuns being harassed by evil spirits in a cemetery. These spirits disturbed their meditation and prevented them from obtaining food. The Buddha then summoned numerous powerful deities, including those from Mount Sumeru and the ocean, to protect the nuns from malevolent entities. These deities were tasked with safeguarding the nuns, ensuring their peace, and repelling any harmful spirits that dared to approach."
1473,灌頂三歸五戒帶佩護身呪經,T 1331 (3),$nti/t1331_03.txt,"When a Brahmin seeks refuge in the Buddha, the Buddha teaches him the three refuges and five precepts, promising protection from thirty-six good deities dispatched by the Four Heavenly Kings. By upholding these precepts, one gains the protection of twenty-five additional deities, each responsible for safeguarding different aspects of the individual's well-being, warding off evil, and ensuring peace. The text emphasizes that those who break these precepts are vulnerable to various misfortunes and even demonic influences, while consistent adherence brings protection, blessings, and a favorable rebirth."
1474,灌頂百結神王護身呪經,T 1331 (4),$nti/t1331_04.txt,"When the Buddha realized that moral decay would set in after his nirvana, with evil spirits and dragons harming people, the god Indra requested a powerful protective mantra. The Buddha then revealed the names of a hundred divine kings residing on Mount Sumeru, each with a specific ability to safeguard individuals who embrace the Three Refuges and wear a knotted cord inscribed with their names. These divine kings offer protection from various threats, including evil spirits, poison, wild animals, legal troubles, difficult childbirth, and illnesses."
1475,灌頂宮宅神王守鎮左右呪經,T 1331 (5),$nti/t1331_05.txt,"The Buddha, while in Magadha, tells a story about a village plagued by demonic disturbances and their reliance on superstitious practices like animal sacrifices to appease spirits. A villager, Kalananda, seeks help from Brahmins who advise him to increase the sacrifices, but the Buddha sends his disciple Maudgalyayana to dispel the evil spirits with protective mantras, converting the villagers to the Buddhist faith. The Buddha then teaches a set of divine names and corresponding incantations to protect homes and ward off evil from all directions, emphasizing their power to banish malevolent entities. It is proclaimed that chanting these divine names brings protection and good fortune, while disrespecting them leads to negative consequences."
1476,灌頂塚墓因緣四方神呪經,T 1331 (6),$nti/t1331_06.txt,"Shortly before his passing in Kusinagara, the Buddha addressed a large gathering about proper funerary practices, explaining the customs for both enlightened beings and common people, and how they differed in places like the land of the ""震旦"". He described the potential for spirits to inhabit burial sites and cause disturbances, especially in the absence of virtue or proper practice. The Buddha then revealed four powerful incantations, each connected to a cardinal direction and a celestial king, to dispel malevolent entities and provide protection for those visiting or maintaining tombs and stupas."
1477,灌頂伏魔封印大神呪經,T 1331 (7),$nti/t1331_07.txt,"The Buddha, in response to a request from Indra, teaches about a divine seal and associated mantras to protect against evil spirits and illnesses. This involves visualizing the Buddha, his disciples, and five powerful deities, each associated with a cardinal direction and a specific color. By invoking these deities and their numerous spirit attendants, one can create a protective barrier, warding off negative influences and promoting well-being. The Buddha also mentions seven gods that can be invoked to protect people's homes and drive away the evil."
