term,term_introduced_by,valid_terminology,hanyu_pinyin,translation_type,english_equivalent,sanskrit_equivalent,old_chinese,later_han,middle_chinese,notes,document_frequency,error,validation
猗覺,An Shigao,False,yī jué,Partial term,"Oh, awakening!",,?,?,?,"'猗覺' is not a standard, recognized Buddhist terminology. '猗' (yī) often functions as an interjection or particle expressing admiration or a connection, while '覺' (jué) means 'awakening' or 'enlightenment'. The combination typically appears in texts where '猗' emphasizes or precedes '覺', rather than forming a distinct, defined term.",2,,
定覺,An Shigao,True,dìng jué,Semantic,fixed awakening,samādhi-bodhi,,,,"A Chinese compound meaning 'fixed awakening' or 'definite enlightenment', also interpreted as an 'awakening of concentration'. The Sanskrit equivalent is a conceptual pairing of *samādhi* (concentration) and *bodhi* (awakening).",7,,
縛結,An Shigao,True,fùjié,Semantic,bonds and fetters,bandhana,,,,"Refers to the ties, bonds, or defilements that bind sentient beings to cyclic existence (saṃsāra), preventing liberation. It can also be a translation for Sanskrit saṃyoga.",7,,
離苦,An Shigao,True,lí kǔ,Semantic,to depart from suffering; freedom from suffering,duḥkha-vimukti,,,,"A fundamental concept in Buddhist teachings, representing the goal of escaping the cycle of suffering (duḥkha) and attaining liberation. It often appears in the phrase 離苦得樂 (lì kǔ dé lè), meaning 'to depart from suffering and attain happiness/joy.'",10,,
非法,An Shigao,True,fēifǎ,Semantic,"non-Dharma, unlawful, illegal, unrighteous, contrary to Dharma",adharma,,,,"Used in Buddhist contexts to describe actions, teachings, or phenomena that are not in accordance with the Dharma (Buddhist teachings or law), or that are not 'dharma' (a constituent element of existence) in a specific philosophical sense. It often functions as the opposite of '法' (fǎ) or '如法' (rúfǎ, according to Dharma).",101,,
受法,An Shigao,True,shòu fǎ,Semantic,to receive the Dharma; to receive teachings; to receive precepts,dharmagrahaṇa,?,?,?,"This term refers to the act of receiving or accepting Buddhist teachings, principles, or precepts. It is a fundamental concept in Buddhist practice, often used in contexts of initiation or transmission of the Dharma.",13,,
如法說,An Shigao,True,rú fǎ shuō,Semantic,to speak according to the Dharma; to preach correctly; to expound the Dharma lawfully,yathā-dharma-deśanā,,,,"This term refers to the act of expounding the Buddhist teachings in a manner that is faithful to the Dharma, without distortion or personal bias. It emphasizes the importance of accuracy and adherence to the principles of truth in teaching.",3,,
隨法行,An Shigao,True,suí fǎ xíng,Semantic,to practice according to the Dharma; following the Dharma,dharmānucaryā,?,?,?,This term refers to the practice of acting in conformity with the Buddhist teachings. It can also refer to a 'Dharma practitioner' (dharmānucārin) when describing a person who follows the Dharma. The '隨' (suí) emphasizes adhering to or following the Dharma's principles.,13,,
律,An Shigao,True,lǜ,Semantic,Vinaya; monastic rules/discipline/precepts; law,Vinaya,?,?,?,"In Buddhism, 律 (lǜ) refers to the Vinaya, which are the monastic rules and discipline for monastics. It constitutes one of the 'Three Baskets' (Tripitaka) alongside the Sutras (經) and Abhidharma (論).",134,,
入,An Shigao,True,rù,Semantic,"enter, enter into, go into, come into",praviś,?,?,?,"A fundamental verb used in numerous Buddhist compounds to denote 'entering' a state, realm, or practice. Examples include rùdìng (入定, 'entering samadhi'), rùmiè (入滅, 'entering nirvana/parinirvana'), and it is also part of the 'six entrances' (六入, ṣaḍāyatana).",108,,
持法,An Shigao,True,chí fǎ,Semantic,upholding the Dharma; Dharma-holder; one who maintains the Dharma,dharmadhara; dhāraka,?,?,?,"This term refers both to the act of upholding the Buddhist doctrine and to an individual (such as a monk or Bodhisattva) who does so. It signifies maintaining, preserving, and protecting the teachings.",11,,
一食,An Shigao,True,yī shí,Semantic,one meal (a day); single meal,ekabhojana,,,,"Refers to the monastic practice of taking only one meal a day, a discipline often observed as part of ascetic practices (dhūtaṅga) or precepts.",13,,
樹下,An Shigao,False,Shùxià,Generic phrase,Under a tree; beneath a tree,vṛkṣādhaḥ,,,,"This is a common descriptive phrase meaning 'under a tree.' While not exclusive to Buddhism, it frequently appears in Buddhist texts, notably in accounts of the Buddha's enlightenment under the Bodhi tree (菩提樹下) and descriptions of ascetic practices.",10,,
臥具,An Shigao,True,wò jù,Semantic,bedding; sleeping mat; couch; sleeping implements,śayanāsana,,,,"Refers to a monk's bedding or sleeping mat, which is one of the eighteen items (十八物 shíbāwù) permitted to a monk or nun.",28,,
第一禪,An Shigao,True,dì yī chán,Semantic,First dhyāna; First meditative absorption,prathama-dhyāna,?,?,?,"Refers to the first of the four dhyānas (meditative absorptions) in Buddhist cosmology and practice. It is characterized by initial application and sustained application (vitarka and vicāra), joy (prīti), and happiness (sukha), along with one-pointedness of mind.",22,,
空行,An Shigao,True,kōngxíng,Semantic,sky-goer,khecara,?,?,?,"This term literally means 'sky-goer' or 'space-goer'. It is frequently used in the compound '空行母' (kōngxíngmǔ), which is a common translation for 'ḍākinī' in Esoteric Buddhism.",54,,
受教,An Shigao,False,shòu jiào,Generic phrase,to receive instruction; to be taught; (polite) I have learned a lot from your teaching,,,,,"This is a common Chinese phrase meaning 'to receive instruction' or 'to be taught'. It is often used as a polite acknowledgement of someone's teaching or advice, implying 'thank you for your teaching' or 'I have learned a lot'. It is not considered specialized Buddhist terminology.",6,,
染,An Shigao,True,rǎn,New meaning,defilement; attachment; stain; pollution; passion,"rāga, kleśa",?,?,?,"While '染' originally means 'to dye' or 'to stain' in common Chinese, in Buddhist contexts it acquires the specialized meaning of 'defilement,' 'attachment,' or 'passion,' referring to mental or spiritual impurities and clinging that bind beings to cyclic existence (saṃsāra).",25,,
惑,An Shigao,True,huò,Semantic,"delusion, confusion, bewilderment",moha,?,?,?,"A fundamental Buddhist concept referring to mental afflictions or ignorance that obscures true reality, primarily translating Sanskrit *moha*. It is a root defilement (klesha) that leads to suffering.",14,,
覺知,An Shigao,True,juézhī,Semantic,"awareness, cognition",jñāna,?,?,?,"The term combines '覺' (jué), meaning 'to awaken, to perceive, to be aware', and '知' (zhī), meaning 'to know, to understand'. It refers to the faculty of perception, understanding, and conscious knowing. It is often used to describe a state of being aware or having direct knowledge.",10,,
有愛,An Shigao,True,Yǒu ài,Semantic,attachment to existence; craving for existence,bhavatṛṣṇā,,,,"This term signifies the attachment or craving for continued existence in the cycle of rebirth (saṃsāra). It is a form of *tṛṣṇā* (craving) and is often specifically used to translate *bhavatṛṣṇā* (craving for existence), which is one of the three types of craving (tṛṣṇā) mentioned in Buddhist teachings.",33,,
三惡行,An Shigao,True,sān è xíng,Semantic,Three unwholesome actions,trīṇy akuśalāni karmāṇi,?,?,?,"Refers to the three types of unwholesome actions (akuśala-karman) that lead to negative karmic results: those of body (kāya), speech (vāc), and mind (manas). These three categories form the basis for the more detailed 'ten unwholesome actions' (十惡業).",6,,
不信,An Shigao,True,bù xìn,Semantic,"disbelief, lack of faith, unbelief",aśraddhā,?,?,?,"A lack of faith or trust, often referring to disbelief in the Three Jewels or the Dharma. It is considered an obstacle to spiritual progress and is listed as an affliction (kleśa).",18,,
三清淨行,An Shigao,True,sān qīng jìng xíng,Semantic,Three pure practices; Three pure deeds; Three pure actions,triśuddha-karma,,,,"These three pure practices are fundamental for bodhisattvas, often referring to the purification of body, speech, and mind (kāya-vāk-manas). They are crucial for cultivating virtues and attaining enlightenment. They can also refer to three specific categories of pure actions as described in different sutras, such as the pure practices of generosity (dāna), morality (śīla), and meditation (dhyāna), or three aspects of the six pāramitās.",2,,
本念,An Shigao,True,běn niàn,Semantic,original thought; fundamental mind; initial thought,mūla-citta; prakṛti-citta,?,?,?,"本念 (běn niàn) refers to the original, fundamental, or inherent state of mind, often implying its pure and unconditioned nature before defilements. It can also refer to the initial thought or aspiration for enlightenment (bodhicitta). In some contexts, it can simply mean 'present thought' or 'current thought' that arises from one's inherent nature.",2,,
信本,An Shigao,True,xìnběn,Semantic,Root of faith,śraddhā-mūla,?,?,?,"This term combines 'faith' (信, xìn) and 'root/foundation' (本, běn), emphasizing faith as the fundamental basis or origin for spiritual practice. It is conceptually related to 信根 (xìn gēn, śraddhā-mūla or śraddhā-indriya), which is one of the Five Roots (五根).",2,,
無為解脫,An Shigao,True,wúwéi jiětuō,Semantic,unconditioned liberation; liberation of non-activity; liberation of non-action,asaṃskṛta-vimokṣa,?,?,?,"This term refers to a state of liberation (解脫) that is unconditioned (無為), meaning it is not produced, destroyed, or subject to change. It is closely associated with Nirvāṇa and the unconditioned dharmas (asaṃskṛta-dharma).",9,,
阿含,An Shigao,True,Āhán,Transliteration,Āgama (collections of discourses),āgama,*qa-gəm,ʔa-ɦam,ʔa-ɣam,"Āhán (阿含) is a transliteration of the Sanskrit/Pali term 'Āgama', referring to the collections of early Buddhist discourses, particularly those preserved in the Chinese Buddhist canon that parallel the Pali Nikāyas.",33,,
優婆塞,An Shigao,True,Yōupósāi,Transliteration,"Upāsaka (male lay devotee, lay follower)",Upāsaka,*ʔiws bra sˤəjʔ,*ʔjuw ba sˤəj,*ʔjuw ba sˤəj,Refers to a male lay practitioner who takes refuge in the Triple Gem and observes the five precepts. The female equivalent is 優婆夷 (Upāsikā).,455,,
度世道,An Shigao,True,dù shì dào,Semantic,The path of saving the world; the way of salvation for the world,loka-tāraṇa-mārga,?,?,?,"This term is a descriptive phrase composed of fundamental Buddhist concepts rather than a single, fixed technical term or idiom. '度' (dù) means 'to cross over, to save, to ferry across,' often referring to saving sentient beings. '世' (shì) refers to the world or saṃsāra. '道' (dào) means 'path, way, doctrine.' Thus, '度世道' refers to the path or doctrine through which the world (or its sentient beings) can be saved or cross over to liberation.",5,,
老病死,An Shigao,True,lǎo bìng sǐ,Semantic,"old age, sickness, and death; aging, illness, and death",jarā-vyādhi-maraṇa,?,?,?,"These are three of the four major sufferings (duḥkha) in Buddhism, alongside birth (生/jāti). They are fundamental aspects of existence, often discussed in the context of the Four Noble Truths and Dependent Origination (pratītyasamutpāda).",48,,
四非常,An Shigao,True,sì fēicháng,Semantic,Four Impermanences; Four Not-constants,catvāry anityāni,,,,"Refers to the four aspects or kinds of impermanence in Buddhist thought. These typically include the impermanence of all conditioned phenomena (一切有為法無常), all formations/activities (一切行無常), all dharmas/phenomena (一切諸法無常), and all sentient beings (一切眾生無常).",11,,
知盡,An Shigao,True,zhī jìn,Semantic,exhaustion of knowledge; perfect knowledge; knowledge of cessation,jñānā-kṣaya,?,?,?,"This term refers to the perfect knowledge or full understanding that leads to the complete eradication of defilements (āsravas), a crucial aspect of arhatship. It signifies the knowledge that the cycle of suffering and rebirth has ended. It is closely related to 智盡 (zhì jìn), which also means 'exhaustion of wisdom/knowledge'.",5,,
四事,An Shigao,True,sì shì,Semantic,four requisites; four matters; four offerings,catur-pratyaya,?,?,?,"This term commonly refers to the four requisites for monks and nuns (clothing, food, bedding, medicine). It can also refer more generally to 'four matters' (catur-vastu) or 'four offerings' (catur-pariṣkāra), depending on the specific Buddhist context.",24,,
生死根,An Shigao,True,shēngsǐgēn,Semantic,root of birth and death; root of saṃsāra; fundamental defilements,saṃsāramūla,?,?,?,"This term refers to the fundamental defilements (kleśa) that are the root cause of repeated birth and death (saṃsāra). Specifically, it often points to craving (tṛṣṇā), ignorance (avidyā), and wrong views (dṛṣṭi) as the roots of saṃsāra.",9,,
災,An Shigao,True,zāi,Semantic,"calamity, disaster, misfortune","āpad, vipatti",,,,"This term, meaning calamity or disaster, is a common Chinese character used extensively in Buddhist contexts. It frequently appears in Buddhist compounds such as '三災' (sānzāi, 'three calamities') and '八難' (bānàn, 'eight difficulties'), which describe various forms of suffering and obstacles to enlightenment.",2,,
前世因緣,An Shigao,True,qiánshì yīnyuán,Semantic,karmic connections from a past life,pūrvajanma-hetupratyaya,,,,Refers to the karmic connections or relationships that originate from a previous existence and influence present life.,2,,
三世,An Shigao,True,sān shì,Semantic,"three times (past, present, future); three ages; triple world",traikālya,,,,"Refers to the three divisions of time: past (過去世), present (現在世), and future (未來世). It is a fundamental concept in Buddhism, particularly in understanding causality (karma) and the cycle of rebirth (saṃsāra).",215,,
七事,An Shigao,True,qī shì,Semantic,Seven matters,sapta-vastu,,,,"A generic phrase meaning 'seven matters' or 'seven things'. In Buddhist contexts, it often refers to specific lists of seven items, such as the seven kinds of wealth (七聖財, sapta-dhana), the seven categories of offerings (七事供養), or the seven things to carry with oneself (七事隨身).",2,,
三事,An Shigao,True,sān shì,Semantic,three matters; three things/affairs,triṇi vastūni,?,?,?,"This is a general term in Buddhist texts, referring to various sets of three concepts, practices, or aspects. The specific meaning depends on the context, e.g., 'three matters of purity' (三淨事), 'three matters of practice' (三行事).",7,,
婬,An Shigao,True,yín,Semantic,"Lust, sexual misconduct, improper sexual conduct","kāma, rāga, abrahmacaryā",?,?,?,"The character '婬' refers to lust or excessive sexual desire. In a Buddhist context, it commonly denotes sexual misconduct (abrahmacaryā) and is a key aspect of the third of the five precepts, 'abstaining from sexual misconduct'.",73,,
惡口,An Shigao,True,è kǒu,Semantic,harsh speech; evil speech; abusive language,pāruṣyavāda,,,,"'惡口' is one of the ten unwholesome actions (daśa-akuśala-karmapatha, 十惡業道), specifically one of the four unwholesome actions of speech. It refers to speaking harshly, using abusive or reviling language, and contributes to negative karma.",105,,
妄言,An Shigao,True,wàng yán,Semantic,"false speech, lying, deceitful speech",mṛṣāvāda,?,?,?,"One of the four types of unwholesome speech (vāk-karma) and one of the ten evil deeds (daśa-akuśala-karma). It refers to intentionally speaking what is not true, often for personal gain or to harm others.",69,,
生死識,An Shigao,True,shēngsǐshí,Semantic,Consciousness of birth and death,saṃsāravijñāna,,,,"This term refers to the consciousness that underlies and perpetuates the cycle of transmigration (saṃsāra). It is sometimes associated with the ālaya-vijñāna (storehouse consciousness) due to its role in carrying karmic seeds through successive existences, or more generally, any consciousness bound by defilements within saṃsāra.",11,,
持,An Shigao,True,chí,Semantic,"to hold, to maintain, to uphold, to keep, to observe","dhāraṇa, dhṛ",?,?,?,"Commonly used in Buddhist compounds such as 持戒 (chíjiè, observe precepts), 持咒 (chízhòu, recite mantras), and 持名 (chímíng, recite the name of a Buddha/bodhisattva).",20,,
瞋恚止,An Shigao,True,chēnhuì zhǐ,Semantic,Cessation of hatred and anger; Stopping hatred and anger,dveṣa-nivṛtti,,,,"A descriptive term for the practice of stopping or calming hatred and anger, which are considered defilements (kleśa) in Buddhism. '瞋恚' refers to dveṣa (hatred/aversion) or krodha (anger), and '止' means to stop or cease.",2,,
貪欲止,An Shigao,False,tānyùzhǐ,Generic phrase,stopping greed and desire; cessation of greed and desire,rāga-nirodha,,,,"The concept of stopping greed and desire is fundamental in Buddhism. However, '貪欲止' is not a widely recognized fixed technical term. It is more commonly expressed as '止貪欲' (stopping greed/desire) or '斷貪欲' (cutting off greed/desire) in Buddhist texts. This phrase functions as a descriptive generic phrase rather than a specific, canonical compound.",2,,
十八種,An Shigao,True,shí bā zhǒng,Semantic,eighteen kinds; eighteen types; eighteen varieties,aṣṭādaśa (often modifying a noun such as dhātavaḥ or āyatanāni),,,,"This term means ""eighteen kinds"" or ""eighteen types"" and serves as a numerical descriptor in various Buddhist enumerations, such as the eighteen dhātus (十八界, aṣṭādaśa dhātavaḥ) or the eighteen āyatanas (十八處, aṣṭādaśāyatanāni).",5,,
色陰,An Shigao,True,sè yīn,Semantic,form skandha,rūpa-skandha,?,?,?,"One of the five aggregates (pañca-skandha) that constitute a sentient being, referring to the physical body and all material phenomena.",66,,
痛痒陰,An Shigao,False,tòng yǎng yīn,Partial term,Aggregate of pain and itch (not a standard Buddhist term),,?,?,?,"While 陰 (yīn) can refer to skandha (aggregate) in Buddhist terminology (e.g., 五陰 for pañcaskandha), '痛痒陰' (pain-itch aggregate) is not a recognized or standard Buddhist compound term. '痛' (pain) and '痒' (itch) are types of sensations that would typically fall under '受陰' (shòuyīn), the vedanā-skandha (aggregate of feelings/sensations).",3,,
思想陰,An Shigao,False,sīxiǎng yīn,Partial term,Aggregate of thought/ideation,,,,,"The term combines '思想' (thought/ideation) with '陰' (aggregate/skandha), but it is not a standard Buddhist term for any of the five aggregates. The aggregate of perception/ideation is *saṃjñā-skandha*, typically rendered as 想陰 (xiang yin). Volitional mental formations are part of *saṃskāra-skandha* (行陰).",2,,
識陰,An Shigao,True,shíyīn,Semantic,consciousness aggregate,vijñānaskandha,,,,"One of the five skandhas (pañca-skandha), referring to the aggregate of consciousness. It is the sixth and final skandha in some enumerations, or the fifth if referring to the standard five. It represents the aspect of mind that cognizes objects and forms mental fabrications.",51,,
十二衰,An Shigao,True,shí'èr shuāi,Semantic,Twelve Declines,,,,,"Refers to twelve phenomena experienced by a Bodhisattva just before attaining Buddhahood, signifying the end of their Bodhisattva career and the imminent manifestation of Buddhahood.",9,,
聚,An Shigao,True,jù,Semantic,"collection, aggregate, heap, assembly, accumulation","skandha, rāśi",?,?,?,"In Buddhist contexts, '聚' often refers to a 'collection', 'aggregate', or 'heap', notably in terms like '五蘊聚' (wǔyùnjù, the five skandhas or aggregates) which are fundamental to Buddhist psychology and philosophy. It can also refer to any assembly or accumulation.",5,,
墮地獄,An Shigao,True,duò dìyù,Semantic,to fall into hell; to descend into hell; rebirth in hell,narakapāta,?,?,?,"A fundamental concept in Buddhist cosmology and karma, referring to rebirth in the lower realms of hell as a consequence of unwholesome actions.",9,,
歸命佛,An Shigao,True,guīmìngfó,Semantic,Homage to the Buddha; I take refuge in the Buddha,namo Buddhāya,,,,"歸命 (guīmìng) is a semantic translation of the Sanskrit 'namas' or 'namo', meaning 'homage' or 'I bow to'. '歸' means to return, to go back to, to rely on; '命' means life, destiny, command. Together, it conveys dedicating one's life or taking refuge in the Buddha. It is often used in formulas like 'Namo Amitābha'.",17,,
歸命法,An Shigao,True,guī mìng fǎ,Semantic,Dharma of taking refuge; Homage Dharma,śaraṇagamana-dharma,?,?,?,"Refers to the teaching or practice of taking refuge in the Three Jewels (Buddha, Dharma, Sangha). '歸命' (guīmìng) is a common translation for the Sanskrit term 'namas' or 'namo', meaning homage or reverence.",6,,
歸命比丘僧,An Shigao,True,guīmìng bǐqiū sēng,Mixed,Homage to the community of monks; I take refuge in the Bhikṣu-Saṅgha,namo bhikṣu-saṅghāya,,,,"The term combines 歸命 (guīmìng), a semantic translation for 'homage' or 'taking refuge,' with 比丘 (bǐqiū) and 僧 (sēng), which are transliterations for 'bhikṣu' (monk) and 'saṅgha' (community) respectively. It is an expression of veneration and refuge.",3,,
比丘僧,An Shigao,True,bǐ qiū sēng,Mixed,Bhikṣu; monk; male monastic,bhikṣu,?,?,?,"The term combines '比丘' (bǐqiū), a transliteration of Sanskrit 'bhikṣu' (mendicant, monk), with '僧' (sēng), which is a short form of '僧伽' (sēngqié), a transliteration of Sanskrit 'saṃgha' (community of monastics). In this context, '僧' also semantically means 'monk' or 'monastic'. Thus, it's a mixture of transliteration ('比丘') and semantic usage derived from a transliteration ('僧'). It generally refers to a male monastic.",237,,
種,An Shigao,True,zhǒng,Semantic,"seed, germ, potential",bīja,?,?,tsyongX,"A fundamental concept in Buddhism, '種' refers to the latent potential or karmic imprint (bīja) left by actions, thoughts, and words. These 'seeds' are stored, often conceptually within the ālaya-vijñāna (storehouse consciousness), and ripen into future experiences and results, thereby perpetuating the cycle of rebirth (saṃsāra).",11,,
化生,An Shigao,True,huàshēng,Semantic,"transformation birth, apparitional birth, spontaneous generation",upapāduka,?,?,?,"One of the four modes of birth (caturyoni), where beings are born instantaneously without parents, such as gods, hell-beings, and some types of pretas and humans, often appearing fully formed. It signifies birth by transformation rather than by womb, egg, or moisture.",76,,
卵生,An Shigao,True,luǎnsheng,Semantic,oviparous birth,aṇḍaja,,,,One of the four types of birth (四生).,31,,
慧人,An Shigao,True,huìrén,Semantic,wise person; person of wisdom,prajñāvant; paṇḍita,?,?,?,"A descriptive term for someone possessing wisdom (prajñā), often used in contrast to a foolish person (愚人 yú_rén). It refers to an individual who understands the Dharma or has attained a degree of spiritual insight.",7,,
禪行,An Shigao,True,chánxíng,Semantic,meditation practice,dhyānacaryā,?,?,?,"A compound term combining 禪 (Chan/meditation) and 行 (practice/conduct). It refers to the practice of meditation, particularly in the Chan/Zen tradition.",9,,
法想,An Shigao,True,fǎ xiǎng,Semantic,perception of dharmas; idea of dharmas; conception of things,dharmasaṃjñā,?,?,?,"Refers to the mental activity of conceiving or perceiving 'dharmas' (elements of existence or phenomena). In Buddhist philosophy, particularly Yogācāra, it often implies a deluded grasping at the inherent existence of these perceived dharmas, leading to attachment and suffering. It's formed from 法 (dharma) and 想 (saṃjñā, perception/conception).",27,,
舍衛祇樹給孤獨園,An Shigao,True,Shèwèi Qíshù Jǐgūdúyuán,Mixed,"Jetavana-Anāthapiṇḍika Vihāra in Śrāvastī; Jetavana, the grove of Anāthapiṇḍika, in Śrāvastī",Śrāvastī Jetavanā anāthapiṇḍikasyārāma,,,,"This term refers to the famous monastery where the Buddha spent 19 rainy seasons. It is located in the city of Śrāvastī (舍衛, a transliteration). The monastery was a park (園) originally owned by Prince Jeta (祇樹, 祇 is a transliteration of Jeta, 樹 means 'grove'), and purchased by the wealthy merchant Anāthapiṇḍika (給孤獨, a semantic translation meaning 'Giver to the Helpless'). Thus, the full name means 'The monastery in Jeta's Grove, donated by Anāthapiṇḍika, in Śrāvastī'.",9,,
佛教,An Shigao,True,Fójiào,Mixed,Buddhism,Buddha-śāsana,,,,"The term 佛教 (Fójiào) combines 佛 (Fó), which is a transliteration of 'Buddha', with 教 (jiào), which is a semantic translation meaning 'teaching' or 'religion'. Together, they form the concept of 'Buddhism' or 'Buddha's teachings'.",124,,
無常想,An Shigao,True,wúchángxiǎng,Semantic,perception of impermanence,anityasaṃjñā,?,?,?,One of the ten saṃjñā (perceptions/notions).,49,,
